pid,title,transtitle,author,translator,poem,transpoem,note,abio,tbio,language,lang,image,image2,imagecredit,imagecredit2,origaudio,translaudio,edition,pagetype
under-one-little-star,Pod jedną gwiazdką,Under One Little Star,Wisława Szymborska,VanJessica Gladney,"Przepraszam przypadek, że nazywam go koniecznością.
Przepraszam konieczność, jeśli jednak się mylę.
Niech się nie gniewa szczęście, że biorę je jak swoje.
Niech mi zapomną umarli, że ledwie tlą się w pamięci.
Przepraszam czas za mnogość przeoczonego świata na sekundę.
Przepraszam dawną miłość, że nową uważam za pierwszą.
Wybaczcie mi, dalekie wojny, że noszę kwiaty do domu.
Wybaczcie, otwarte rany, że kłuję się w palec.
 
Przepraszam wołających z otchłani za płytę z menuetem.
Przepraszam ludzi na dworcach za sen o piątej rano.
Daruj, szczuta nadziejo, że śmieję się czasem.
Darujcie mi, pustynie, że z łyżką wody nie biegnę.
 
I ty, jastrzębiu, od lat ten sam, w tej samej klatce,
zapatrzony bez ruchu zawsze w ten sam punkt,
odpuść mi, nawet gdybyś był ptakiem wypchanym.
Przepraszam ścięte drzewo za cztery nogi stołowe.
 
Przepraszam wielkie pytania za małe odpowiedzi.
Prawdo, nie zwracaj na mnie zbyt bacznej uwagi.
Powago, okaż mi wspaniałomyślność.
Ścierp, tajemnico bytu, że nie mogę być wszędzie.
 
Przepraszam wszystkich, że nie mogę być każdym i każdą.
Wiem, że póki żyję, nic mnie nie usprawiedliwia,
ponieważ sama sobie stoję na przeszkodzie.
 
Nie miej mi za złe, mowo, że pożyczam patetycznych słów,
a potem trudu dokładam, żeby wydały się lekkie.","I’m sorry, Coincidence for calling you Necessity.
Necessity, I’ll say sorry — just in case I’m wrong.
Happiness, forgive me when I take you as my own.
May the dead I don’t remember forgive that I forget.
I’m sorry, Time, for the seconds I’ve missed.
I’m sorry, Loves of Old, for treating New as First.
Forgive me, way-off wars, for bringing home lillies.
Forgive me, open wounds, for pricking my finger.
To those shouting to be heard, I’m sorry for listening to Drake instead.
To those on trains at 5 a.m., I’m sorry for sleeping through the morning.
Heckled Hope, forgive me for my loud bursts of laughter.
Dry deserts, I didn’t mean to hog all the water.
And you, Sir Hawk, grand bird, in your grand cage, 
 in your same spot, with your same stare,
 Forgive me.
I’m sorry, Trees. I sit at four legged tables.
I’m sorry, Long Questions for my short replies.
Ignore me, Truth.
Be gentle, Gravity.
Forgive me, Ms. Mystery of Being while I pluck the threads of your veil.
Soul, don’t blame me for losing you so often.
I’m sorry to Everything that I can’t be Everywhere.
I’m sorry to Everybody that I can’t be Everyone.
I know I won’t be excused, not as long as I live,
because I keep tripping on my untied shoelaces.
But Speech, I beg you pardon me when I borrow weighty words,
and later labor to make them light.","<p>My translation process was pretty fun. I reviewed several other poetic translations, and a classmate who spoke Polish and loved Szymborska helped me with direct translations. After researching the author and executing some poetic license I wrote my translation.</p>","<p>Like this poem, Polish poet Wisława Szymborska (1923–2012) is just fine untitled. No one label could fit the unique amalgamation of simplicity, sincerity, and solemnity that seeps through her poems, illustrations, collages, photographs, and anecdotes. Szymborska’s poetry is known for its layers of profundity under a light-hearted, witty surface. She lived in Krakow, Poland, for most of her life and wrote about the Polish countryside and historical events. Her poetry is internationally revered and has been translated into almost every language. In 1996, Szymborska received the Nobel Prize for Literature; her acceptance speech was about the irony in the notion of poetry as a profession.</p>","<p>VanJessica Gladney has lived in Georgia, Oklahoma, Arkansas, Massachusetts, and now Philadelphia. She is a third-year student at the University of Pennsylvania, where she is an English major. She has a gorgeous and very beloved cat named Prism.</p>",Polish,pl,../assets/images/images_16/szymborska.JPG,,photo by Natalia Pleśniak,,,,2016,submission
by-the-agua-grande,Lá no Água Grande,By the Água Grande,Alda do Espírito Santo,Marisa Bruno,"Lá no Água Grande
Lá no «Água Grande» 
a caminho da roça negritas batem que batem co’a roupa na pedra. 
Batem e cantam modinhas da terra.
Cantam e riem em riso de mofa histórias contadas, 
arrastadas pelo vento.
Riem alto de rijo, com a roupa na pedra 
e pōem de branco a roupa lavada.
As crianças brincam e a água canta. 
Brincam na água felizes… 
Velam no capim um negrito pequenino.
E os gemidos cantados das negritas 
lá do rio ficam mudos lá na hora do regresso… 
Jazem quedos no regresso para a roça.","By the Água Grande*
Bound for the fields, by Água Grande, 
Black women beat and beat cloth against stone. 
They beat and sing songs of their home.
They sing and laugh laughs full of scorn, 
Tell stories… tossed into wind.
Strongly they laugh, keeping cloth against stone, 
Turning to white the cloth that they clean.
The children play! And the waters sing! 
The children in gay waters play…
Keeping baby black boy in the reeds.
…
The cries that the black women by the river sing 
Go quiet at the hour of return… Fall still returning to the fields.

*The Água Grande River runs through São Tomé’s most populated province, 
which is also called Água Grande.","<p>I have made what feel like thousands of attempts to properly translate Alda do Espírito Santo’s “Lá no Água Grande,” and have failed in each of them. But, here, I submit one such attempt for publication in the hopes that my translation can help shed light on this important poet.</p>","<p>As both writer and government leader, Alda do Espírito Santo played an essential role in São Tomé and Príncipe’s transition to independence from Portugal. She writes as a woman, to women, and for women, presenting her readers with images of strong women who have the power to liberate the islands from Portuguese colonial oppression. Despite her privileged upbringing, she dedicates her words to the working-class women of the islands who carried, both figuratively and literally, the future of the islands on their backs. The women she describes in poems like “By the Água Grande” are mothers, workers, and, most importantly, fighters.</p>
<p>Alda Espírito Santo’s poetry, which so lauded the islands’ women, celebrated and nourished a culture that relied on the power and strength of women. It points to the many ways in which women poets in Africa have played—and still play—an important role as agents for change in the liberated Portuguese colonies. Despite her influence in São Tomé, her poetry, like that of most Lusophone African (and especially women) writers, has been relegated to the periphery of post-colonial studies.</p>","<p>Marisa Bruno wrote her senior thesis on Alda do Espírito Santo, hoping to bring some attention to two marginalized categories of Lusophone (Portuguese-language) writers: African Lusophone writers and female Lusophone writers. She was a Portuguese target in the Huntsman Program and graduated from the University of Pennsylvania in May 2016.</p>",Portuguese,pt,,,,,,,2016,submission
the-paths,Пътеките,The Paths,Pavel Matev,Mirela Zaneva,"Пътеките, пътеките на птиците, 
на полуделите треви, 
останаха зад нас, уви! 
И в твоите сълзи —
по ресниците.

Самотното ни връщане 
не ще ни отведе далеч. 
О, те останаха без реч 
от страстни ветрове прегръщани.

Желаното спасение 
при спомена се приюти 
и с него се загърна ти — 
едно невиждано видение.

Не ме търси… Не ме търси… 
Загинаха сами плачът и любовта. 
И оня смях. И радостта. 
С пътеките, с пътеките отминаха.

Понякога в зениците 
ще пламнат с таен зов 
ту изгорялата любов 
или пътеките на птиците.","The paths, the paths of birds,
of maddened trees,
they have remained behind, 
and hidden barely
in your tears.

This solitary return
will not return us far.
Oh, these paths have left
without a word, embraced
by ardent winds.

And I know you too have embraced
old memories as shelter,
a wanted salvation,
a sight that’s still unseen.

Don’t look for me. Don’t look for me…
laments and love have died alone.
And if you think about the laughter
and that joy — it’s with the paths,
with the paths, they passed us by.

Only sometimes in your eyes,
a secret call will set alight
perhaps the love that burned,
perhaps the paths,
the paths of birds.","<p>My initial steps in translating a given work are attempts to place the poem inside a larger context of the author’s life, views, experiences. Afterwards, I begin with a quick translation, something crude and instantaneous. I focus on the new text and circle, underline, highlight all ideas that come up until there is more ink than words on the page. I then look at the original and take on more edits based on both the rough translation and the original. I rinse and repeat quite a bit over a day or two and then try to forget the whole matter ever happened. When I return to the poem, fresh connections usually appear. So far, this is what I have done with “The Paths.” The current version is still a quite humble attempt to carry over the images from Bulgarian to English. I have recently memorized the poem fully and have created a memory palace of sorts, with the hopes that this will aid me in future revisions.</p>","<p>Pavel Matev (Павел Матев, 1924–2006) is celebrated as one of the best lyricists in Bulgarian poetry. Growing up in the countryside, he devoted his work to the study of nature and love, and focused on the quiet, simple beauty of both. He is considered notoriously difficult to translate because his distinct melancholic tone is rooted in his rhyme patterns and heavily embedded in the minimalism and succinctness of his phrases.</p>","<p>As a psychology major, poetry has not been central to my academic pursuits. However, after taking Professor Taije Silverman’s class, my interest in translation and my connection with poetry has grown. Nowadays, most of my time goes to applying concepts from game theory to evolutionary models, but translating has become a favorite hobby.</p>",Bulgarian,bg,../assets/images/images_16/matev.jpg,,photo by Mirela Zaneva,,,,2016,submission
from-requiem-2016,Реквием,From <em>Requiem</em>,Anna Akhmatova,Yehudith Dashevsky,"                Нет, и не под чуждым небосводом,
                И не под защитой чуждых крыл,-
                Я была тогда с моим народом,
                Там, где мой народ, к несчастью, был.
                                        1961

<h1>Вместо предисловия</h1>

    <p>В страшные годы ежовщины я провела семнадцать 
месяцев в тюремных очередях в Ленинграде. Как-то раз 
кто-то ""опознал"" меня. Тогда стоящая за мной женщина, 
которая, конечно, никогда не слыхала моего имени, 
очнулась от свойственного нам всем оцепенения и 
спросила меня на ухо (там все говорили шепотом):</p>
     <p>— А это вы можете описать?</p> 
     <p>И я сказала:</p> 
     <p>— Могу.</p> 
     <p>Тогда что-то вроде улыбки скользнуло по тому, что некогда было ее лицом.</p> 

<p>1 апреля 1957, Ленинград</p>

<h1>II</h1>
Опять поминальный приблизился час.
Я вижу, я слышу, я чувствую вас:

И ту, что едва до окна довели,
И ту, что родимой не топчет земли,

И ту, что красивой тряхнув головой,
Сказала: “Сюда прихожу, как домой.”

Хотелось бы всех поименно назвать,
Да отняли список, и негде узнать.

Для них соткала я широкий покров
Из бедных, у них же подслушанных слов.

О них вспоминаю всегда и везде,
О них не забуду и в новой беде,

И если зажмут мой измученный рот,
Которым кричит стомильонный народ,

Пусть так же они поминают меня
В канун моего поминального дня.

А если когда-нибудь в этой стране
Воздвигнуть задумают памятник мне,

Согласье на это даю торжество,
Но только с условьем — не ставить его

Ни около моря, где я родилась:
Последняя с морем разорвана связь,

Ни в царском саду у заветного пня,
Где тень безутешная ищет меня,

А здесь, где стояла я триста часов
И где для меня не открыли засов.

Затем, что и в смерти блаженной боюсь
Забыть громыхание черных марусь,

Забыть, как постылая хлопала дверь
И выла старуха, как раненый зверь.

И пусть с неподвижных и бронзовых век
Как слезы, струится подтаявший снег,

И голубь тюремный пусть гулит вдали,
И тихо идут по Неве корабли.


","                No, not foreign heaven’s shield 
                Protected me, nor foreign wings
                I was with my people then
                When my people endured suffering
                                        1961

<h1>Instead of a Preface</h1>
<p>In the horrid years of the Yezhov terror I spent 
seventeen months waiting in line outside the prison 
in Leningrad. One day somebody “identified” me. 
Then, the woman who stood behind me, whose lips 
were blue from the cold, and who, of course, had not 
known who I was, came out of the stupor in which we 
all were and asked me in a whisper (everyone whispered there):</p>
<p>“Can you describe this?”</p>
<p>And I said, “I can.”</p>
<p>Then something resembling a smile slid over that 
which had once been a face.</p> 
<p>1 April 1957, Leningrad</p>

<h1>Requiem II.</h1>
 
Memorial hour strikes anew.
I see and I hear and I feel all of you —
 
The one whom we scarcely dragged to the window to breathe,
And the one who from earth’s bounds was set free,
 
And that one, shaking her beautiful head,
“I come here as if to my home,” she said.
 
Each one, name by name, I want to recount,
But the list was torn up; there’s no place to find out.
 
For them, I have woven a shroud out of words,
Out of their poor words, which I overheard.
 
Them — I remember, all the time, in every place, 
New woes cannot drive them from memory's space,
 
And if time clamps shut my long worn-out mouth,  
Through which a hundred million people shout,
 
Let the people recall me in a similar way
On the eve of my own memorial day.
 
And if at some point, this country should see
fit to erect a statue of me,
 
My consent I grant to this one note of grace,
But on one condition — that it be placed
 
Not near the sea, where I first opened my eyes:
With the sea I have long since severed all ties,
 
Not in the Tsar’s garden, near that much-cherished tree,
Where an inconsolable shadow searches for me,
 
But here,
where for three hundred hours I stood in wait
and where they didn't unbolt the iron-barred gate.
 
Because even in blissful death I fear
forgetting the clamor of the Black Marias,
 
forgetting how that dreaded car door banged
and that old mother wailing, like a wounded hound. 
 
And let the snow melt, in streams of tears, cries,
From the rims of my motionless, bronze-lidded eyes,
 
And let a prison dove coo, somewhere, far away,
And the ships sail softly by the Neva’s bay.

","<p>One distinct feature of Akhmatova’s poetry is that it is precise. Akhmatova reads as if there can be no other word or sound or even syllable stress for each image and no other image for each meaning. Although I chose to focus on staying as true to her images as possible, there were several places where I chose to stray from the images. One such place is in the fourth couplet, “and the list was torn up.” The Russian language makes use of embedded pronouns, so the original reads “and (they) took away the list,” with an implicit plural actor. However, I thought that using another “they” may create pronoun confusion in the translation. It would not be clear when the “they” refers to the regime and when to its victims. I therefore chose the passive. Another such place is in the seventh couplet, where the original reads “and if (they) clamp shut.” There, I chose to include an actor, although “time” is not true to the image or meaning in its full sense. It is not to time, ie. old age, that Akhmatova is referring, but to Stalin and his men. However, because the original only had an implicit “they,” I chose to avoid explicitly naming of Stalin in the translation. Another significant change I made is in the last line. The Neva, a river in Russia, has a riverbank, not a bay. However, I thought that the perfect rhyme in the end couplet was more important for the tone of the poem at its close than preserving a well-known geographic fact. I admit, however, that this may be a contentious point, and native Russian speakers have all the right and reason to disapprove of this choice. A fourth change is adding specificity to the images in the third-to-last couplet, where I thought that only those who had undergone those times would understand what kind of door was banging and who was wailing. As a final point, I wish to clarify that “Black Marias” are the police cars that would come to round up citizens, often at random, to bring them to jail, or worse. A fear of those black cars was ingrained in the generation of that time.</p>","<p>Anna Akhmatova (Анна Ахматова, 1899–1966) is one of the canonical poets of Russian literature. She grew up near the Black Sea port of Odessa. After studying literature in St. Petersburg, she, along with poets Osip Mandelstam and Sergey Gorodetsky, founded the Acmeism school of poetry, which valued the craft of poetry above its mysterious or symbolic qualities. Akhmatova was known for her rather terse, concise mode of expression, which soon became the model of a new form of expression for Russian women. Some of Akhmatova’s poems were, at a certain point, banned by Stalin, and still others remained unpublished, because they contained explicit anti-regime references. Despite that, her poetry continued to circulate throughout Russia. When her son was sentenced to ten years in a prison camp in Siberia, she attempted to have him released in various ways, including writing propaganda poetry for Stalin. During World War II, Akhmatova would read her poetry to soldiers in military hospitals, as well as write poems that reflected the voices of the people who were victims of Stalin’s regime. She became known as the poet of the Russian people.</p>","<p>Yehudith Dashevsky is a sophomore studying English literature with a concentration in poetry. She is a native Russian speaker, fluent in Hebrew, and is learning Arabic. She thinks that translation is at the core of what humans do every day in their lives — constantly translating from one register of language to another, but also from thoughts and ideals to reality and back again. Yehudith was first introduced to the methods of translating poetry in Professor Silverman’s Translation of Poetry class last spring.</p>",Russian,ru,,,,,,,2016,submission
