pid,title,transtitle,author,translator,poem,transpoem,note,abio,tbio,language,lang,image,image2,imagecredit,imagecredit2,origaudio,translaudio,edition,pagetype
cucumber,Salatalık,Cucumber,Nâzım Hikmet,Monica Wojciechowski,"Avluda diz boyu kar
lapa lapa da yağıyor
hızını alamadı sabahtan beri bir türlü.
Mutfaktayız.
Masada, muşambanın üstünde bahar
Masada, muşambanın üstünde körpecik 
bir salatalık
çiçeği burnunda, pütürlü.
Çepçevre oturmuş bakıyoruz ona
şavkı vuruyor yüzümüze yumuşacık
bir tazeliktir kokuyor bir tazelik.
Çepçevre oturmuş bakıyoruz ona
şaşkın,
düşünceli,
iyimser.
Rüyada gibi bir halimiz var.

Masada, muşambanın üstünde umut
Masada, muşambanın üstünde güzel günler
yeşil bir güneşle yüklü bir bulut
yaklaşan sabırsız zümrüt bir kalabalık
açılıp saçılacak sevdalar
masada, muşambanın üstünde körpecik 
bir salatalık
çiçeği burnunda, pütürlü.

Avluda diz boyu kar
lapa lapa da yağıyor
hızını alamadı sabahtan beri bir türlü.

Nâzım Hikmet
Mart 1960, Moskova","In the yard, snow sits tall
and still, flake after flake falls
since morning, unfulfilled.
We’re in the kitchen.
On the table, atop the cloth, spring —
on the table, atop the cloth, a tender little cuke,
with bumpy husk and blossomed stalk. 
We surround it, staring.
Its cool glow soothes our faces
with a satin sweep.
How fresh its scent, how fresh —
We surround it, staring —
baffled
pensive
light
as if we’re in a dream.
On the table, atop the cloth, hope —
on the table, atop the cloth, mended pep,
a cloud set to spill
a sprouting sun,
seas of eager seeds
nearby,
blooming loves uncovered.
On the table, atop the cloth, a tender little cuke,
with bumpy husk and blossomed stalk. 
In the yard, snow sits tall
and still flake after flake falls
since morning, unfulfilled.

Moscow, March 1960
","<p>Due to what some might call an unusual affinity towards cucumbers, I was immediately drawn to this poem by Nâzım Hikmet. While it was the title that initially caught my attention, it was Hikmet’s descriptions and language (and the feelings they evoked) that drew me to translate the poem. The first line of “Cucumber” talks about the snow outside piling up, despite it being the start of spring. In a conspicuously similar manner, while I was reading the poem one April morning in Philadelphia, it began to snow outside of the library! Through my translation, I sought to replicate the essence of sincere (but slightly irrational) hope — for spring, for a fresh start, for change — as present in Hikmet’s words today as it was years ago.</p>","<p>Nâzım Hikmet (1902-1963) was a Turkish poet, playwright, and revolutionary figure. His political views and support for communism often landed him in jail, where he wrote much of his poetry. His poetry was looked to by much of Turkey’s youth as the poetry of the revolution. He is considered Turkey's first modern poet and was influenced by the Russian Futurist movement. Finally released from jail after starting a hunger strike (which was then joined by international figures), Hikmet moved to the Soviet Union, where he was very well-received.</p>","<p>Monica Wojciechowski grew up in Denville, NJ, but considers Poland to be her second home. She spent this past summer traveling through Eastern and Central Europe, and she stayed with family in Poland’s countryside, harvesting fruit, taking long walks, picking mushrooms, and translating poetry. Nothing makes Monica happier than sharing her heritage with others; whether through stories, food, music, or language, she is always grateful for the opportunity to do so. It was not until recently that Monica discovered the captivating world of literary translation, but now that she has, she doesn’t plan on leaving it anytime soon.</p>",Turkish,tr,,,,,,,2016,submission
the-ninth-letter-on-the-platform,على رصيف المحطة,The Ninth Letter: On the Platform,Nizar Qabbani,Michael Karam,"أعرفُ . .
ونحنُ على رَصيفِ المَحَطَّة
أنَّكِ تنتظرينَ رَجُلًا آخَرَ . .
وأعرِفُ أنني لَم أكُنْ
سِوى مِروَحَةٍ صِينِيَّةٍ خَفَّفَتْ عنكِ حَرارةَ الصَّيفْ
ورَميْتِها بعدَ الصَّيف . .
أعرِفُ أيضًا
أنَّ رَسائِلَ الحُبّ التي كتبتُها لكِ
لم تَكُن سِوى مَرايا رأيتِ فيها غُرُورَكِ . .
وَمَعَ هذا.
سَأحمِلُ حَقائِبَكِ . .
وَحقائِبَ حَبيبِكِ . .
لأنني أستَحي أن أصفَعَ امرأةًٌ
تحمِلُ في حَقيبَةِ يدَيْها البَيْضاءْ
أحلَى أيامِ حَياتي . .
","I know…
as we stand here on the platform
you’ve been waiting for someone else…
And I know I was nothing
but a cheap fan to ease summer’s heat
till summer ended…
I know too
that in my love letters to you,
you saw a mirror.
Still.
I’ll carry your luggage…
And I’ll carry your lover’s luggage…
for I’m too honorable to hurt a lover
who holds, in the white bag
swinging gently from her hands,
the best days of my life…","<p>I chose to translate a Qabbani poem because of how much his name and works remind me of my early schooling in Lebanon. While he is not as famous in America, I hope this is a step towards a growing fascinated audience. Even if you’ve never stood on a train platform, this image of fleeting love is a familiar one. There were some key decisions I had to make in this translation process. I wanted to remain true to the original’s punctuation and shape on the page even at the risk of its flow, in English. I did translate <em>Chinese fan</em> (from the literal Arabic) to <em>cheap fan</em>, because the former doesn’t enlist the same enthymematic suggestion for the English-language reader as it does for the reader of Arabic.</p>
","<p>Nizar Qabbani (<span lang=""ar"">نزار توفيق قباني</span>, 1923–1998) is a timeless Arab poet known for his sensual and romantic verse. Beyond his two dozen volumes of poetry and contributions to the Lebanese newspaper <em>Al Hayat</em>, his poetry is often sung by Lebanese and Syrian vocalists who have popularized his work. Young and old people in Lebanon (where he lived for years) and in Syria (his home country) love these familiar tunes. Qabbani writes of romantic and political despair; his poetry advocates for Arab nationalism and social freedoms for women.</p>",<p>Michael Karam is a senior in the College at the University of Pennsylvania studying economics and international relations with a math minor. He is passionate about languages and bringing communities together. Michael loved memorizing and reciting Qabbani’s poetry when he was in elementary school in Lebanon. Poetry by Qabbani is also a reminder that the people suffering from the war in Syria are humans who have the right to live and love too.</p>,Arabic,ar,,,,,,,2016,submission
you-dont-love-me-you-dont-pity-me,"Ты меня не любишь, не жалеешь","You Don’t Love Me, You Don’t Pity Me",Sergei Yesenin,Malika Kadyrova,"Ты меня не любишь, не жалеешь,
Разве я немного не красив?
Не смотря в лицо, от страсти млеешь,
Мне на плечи руки опустив.

Молодая, с чувственным оскалом,
Я с тобой не нежен и не груб.
Расскажи мне, скольких ты ласкала?
Сколько рук ты помнишь? Сколько губ?

Знаю я — они прошли, как тени,
Не коснувшись твоего огня,
Многим ты садилась на колени,
А теперь сидишь вот у меня.

Пусть твои полузакрыты очи,
И ты думаешь о ком-нибудь другом,
Я ведь сам люблю тебя не очень,
Утопая в дальнем дорогом.

Этот пыл не называй судьбою,
Легкодумна вспыльчивая связь,—
Как случайно встретился с тобою,
Улыбнусь, спокойно разойдясь.

Да и ты пойдешь своей дорогой
Распылять безрадостные дни,
Только нецелованных не трогай,
Только негоревших не мани.

И когда с другим по переулку
Ты пройдешь, болтая про любовь,
Может быть, я выйду на прогулку,
И с тобою встретимся мы вновь.

Отвернув к другому ближе плечи
И немного наклонившись вниз,
Ты мне скажешь тихо: «Добрый вечер!»
Я отвечу: «Добрый вечер, miss».

И ничто души не потревожит,
И ничто ее не бросит в дрожь, —
Кто любил, уж тот любить не может,
Кто сгорел, того не подожжешь.","You don’t love me, you don’t pity me.
Don’t you find me at least a little handsome?
You won’t look at my face but you lose control
with your hands on my shoulders.

You’re young, sensual, teeth bared;
I’m neither gentle with you nor rough.
Tell me, how many have you caressed?
How many hands have you touched? How many lips?

I know — they passed like shadows
without touching your flame.
You’ve made your home on many laps
and now you’re here on mine.

I’ll let you keep your eyes half-shut,
maybe I’m not the one you want to see.
I’m not head over heels either,
drowning in the treasured past.

Don’t call this ardour destiny,
this connection of ours quick to spark —
as easily as I fell into you,
I’ll find it just as easy to part.

And so will you, you’ll find your path,
leaving unhappy days in your wake.
Just don’t touch those who haven’t been kissed,
just don’t tempt those who haven’t been burned.

And when you’re out with another,
strolling arm-in-arm, talking about love,
maybe you’ll see me crossing the street,
and you and I will meet again.

You’ll lean into your companion
and with a tilt of your head,
you’ll whisper to me: “Good evening!”
and I’ll answer: “Good evening, miss.”

And nothing will worry my soul,
and nothing will drive it to shiver —
one who has loved won’t love again,
one who has burned won’t ignite.","<p>I tried to keep the tone if not light then at least uncomplicated. This was tricky for me; I must confess to a fondness for fluffy words. Russian grammar allows for relatively easy rhyming; I chose to forgo an attempt at Yesenin’s rhyming stanzas in favour of a more free structure that would hopefully convey the casual air of Yesenin’s language. Yesenin’s diction often takes on a colloquial character, and his imagery is bright and occasionally jarring. An example of this is the woman in “You Don’t Love Me,” who is flirty and untouchable and for whom he uses a phrase that has more echoes of a wolf baring its teeth than anything a human could do with their mouth. Despite the overall gentle tone of the poem, the narrator’s bitterness shows through his reserve, and for this reason I decided to leave the animalistic imagery.</p>","<p>Sergei Yesenin (Сергей А. Есенин, 1895–1925) was a Russian Imagist. Yesenin’s reputation as a “peasant prophet” stemmed from his rural upbringing and the fact that he was most inspired by village lifestyle and lore, later accentuated in his poetry by post-revolutionary melancholy. In the words of literary critic Yuri Prokushev, Yesenin’s imagery was “not obscured by religious symbols or vocabulary,” which made him endearing to a huge readership.</p>","<p>Malika Kadyrova graduated from the University of Pennsylvania in 2015 with a major in comparative literature and minors in French and classical studies. She’s currently at Moscow State Institute of International Relations, wandering along the postgrad brick road in the direction of a career in simultaneous interpretation.</p>",Russian,ru,,,,,,,2016,submission
under-the-custody-of-time,Propiedad de la espera,Under the Custody of Time,Alejandro Zambra,Roberto Rodriguez,"Trata de sentir el suelo
Sus pies se hunden en la arena seca
Busca sus pies
Detiene el movimiento de sus manos
Ha encontrado sus pies pero no los mira
Todo es igual a como era antes
Necesito explicar que es así,
que todo es igual a un momento anterior, 
doloroso.
Supongo que hay mar ante sus ojos 
y que ella mira el mar
como mira el centro de un espejo difícil.","She tries to feel the ground
Her feet sink on dry sand
She looks for her feet
She stops the movement of her hands
She has found her feet, but she does not look at them
Everything is as it was before
I need to explain that it is this way,
that everything is like a moment already lived,
painful.
I suppose there is an ocean in her gaze
and that she looks at it
the way she looks at a complex mirror.","<p>“Propiedad de la espera” was exactly the poem I didn’t know I was looking for. Several others were tested, but this one struck me on a more personal level. Zambra has a subtle way of transmitting verse with intimidating simplicity, or better yet, decisiveness, which makes it daunting to translate when trying to stay as faithful to the original as possible. At first, I tried to alternate nouns when talking about a subject more than once, such as with “her feet.” I thought about switching between feet and legs in order to counter the more repetitive nature of the English, considering that in Spanish there is no need to directly imply a person’s gender when talking about him/her. “She tries,” “her feet,” “she looks,” “she stops,” and “she has” could not have been avoided without making the poem suffer. For example, the first line would translate literally into something like: “Tries to feel the floor.” The line uses a gender-neutral pronoun. “It” would be the closest comparison. The penultimate verse in the original, “Y que ella [“she”] mira el mar,” is the only indication of this figure’s gender. After reading the poem many times, a title instantly came to mind: “Under The Custody Of Time.” “Propiedad de la espera” literally translates to “Property Of Waiting,” which I don’t think fully grasps the poem’s meaning. To me, this poem is about how bittersweet it is to look back at our past, or even about how we sometimes feel our lives might be slipping from our hands, how we idly stand in place while the world just keeps turning without us. “Under The Custody Of Time</em>…</p>","<p>Alejandro Zambra is a famous twenty-first-century Chilean poet, short story writer, and novelist. He graduated from University of Chile in 1997 with a degree in Hispanic literature, obtained an MA in Hispanic studies in Madrid, and received a PhD in literature in Chile. Zambra is most likely known for his first novel, <em>Bonsái</em>, which won the Chilean Critics Award for best novel in 2006. He has been featured multiple times in magazines such as the <em>New Yorker</em>, the <em>Paris Review</em>, and <em>Tin House</em> in recognition of his literary works. He currently teaches at the School of Literature at Diego Portales University in Santiago.</p>","<p>Roberto Rodríguez was born in San Juan, Puerto Rico. He works at a bookstore and enjoys sharing his favorite books with any who bother asking him. His favorite hobbies include reading and writing, and he longs for the day when he can make a living out of doing what he loves. At gatherings, you might find him engrossed in deep conversation, often mid-pitch through his latest idea for the wildly fantastic novel he is surely destined to write one day.</p>",Spanish,es,,,,,,,2016,submission
three-sonnets,Three Sonnets,Three Sonnets,La Compiuta Donzella,Samantha Pious,"<h1>(1)</h1>
A la stagion che ’l mondo foglia e fiora
acresce gioia a tut[t]i fin’ amanti:
vanno insieme a li giardini alora,
che gli auscelletti fanno dolzi canti;
la franca gente tutta s’inamora,
e di servir ciascun trag[g]es’ inanti,
ed ogni damigella in gioia dimora;
e me, n’abondan mar[r]imenti e pianti.
Ca lo mio padre m’ha messa ’n er[r]ore,
e tenemi sovente in forte doglia:
donar mi vole a mia forza segnore,
ed io di ciò non ho disio né voglia,
e ’n gran tormento vivo a tutte l’ore;
però non mi ralegra fior né foglia.

<h1>(2)</h1>
Lasciar vor[r]ia lo mondo e Dio servire
e dipartirmi d’ogne vanitate,
però che veg[g]io crescere e salire
mat[t]ezza e villania e falsitate,
ed ancor senno e cortesia morire
e lo fin pregio e tutta la bontate:
ond’io marito non vor[r]ia né sire,
né stare al mondo, per mia volontate.
Membrandomi c’ogn’om di mal s’adorna,
di ciaschedun son forte disdegnosa,
e verso Dio la mia persona torna.
Lo padre mio mi fa stare pensosa,
ca di servire a Cristo mi distorna:
non saccio a cui mi vol dar per isposa.

<h1>(3)</h1>
Ornato di gran pregio e di valenza
e risplendente di loda adornata,
forte mi pregio più, poi v’è in plagenza
d’avermi in vostro core rimembrata,
ed invitate a mia poca posseza
per acontarvi, s’eo sono insegnata,
come voi dite, c’ag[g]io gran sapienza,
ma certo non ne son [tanto] amantata.
Amantata non son como vor[r]ia 
di gran vertute né di placimento;
ma, qual ch’i’ sia, ag[g]io buono volere
di servire con buona cortesia
a ciascun ch’ama sanza fallimento:
ché d’Amor sono e viogliolo ubidire.","<h1>(1)</h1>
The jolly pretty lovely lusty month of May
when every heart springs buds begins to rise
the little birds sing sweetly and completely in their Latin lingo
and maken melodye all night with open eyes
and every noble free frank French good person
falls in love and strives to serve his lady
who lives in great joy gaudia rejoicing jouissance:
I’m miserable. I may be going crazy.
My father’s thrown me into sin and error —
he holds me down in torture torment terror:
a lord and a master are his intent.
My will and my desire won’t consent!
I live in greater agony each day.
Therefore I have no joy this month of May.

<h1>(2)</h1>
To leave the world behind is what I want:
forsake its vanity and serve my God,
for mad insane base villainy and falsehood
swell rise take wing from out Pandora’s box.
Intelligence and courtesy are dying
and prix worth goodness generosity:
therefore I want no master and no lord
nor profane and urbane mundanity.
Remembering the evil which adorns all men,
I scorn despise abhor them in contempt
and it’s toward God my soul self body flee.
My father hurts wounds puts me in grave pain:
from Christ he turns me to the world again,
and I don’t know whose wife, whose bride, I’ll be.

<h1>(3)</h1>
Oh lord arrayed in prix price value valiance,
in shining praise and worthiness adorned,
I prize myself more worthy, since you’re pleased
to have me in your heart, and you implore
what little strength I have, to tell you, if I can,
if I am Latin literate, because (you say)
I have intelligence — but certainly I’m not
adorned in such cloak mantle fine array.
Mantled am I not, as I would like to be,
in virtue or the courtier’s art of pleasing;
whatever I may be, I have good will alway
to serve all those in courtly courtesy
who truly love withouten lie deceiving:
for Love’s I am, and him I will obey.","<p>I first encountered La Compiuta Donzella a year or two ago, when I was first learning Italian, in a historical anthology of medieval and early modern literature. As a woman translator, I have always found it convenient to assume female authorship unless otherwise specified. I made no exception while reading and rewriting the sonnets of La Compiuta Donzella. Even knowing, as a student of medieval literature, that medieval poets and writers tend toward self-camouflage rather than self-revelation, I persisted in reading her poems autobiographically — or semi-autobiographically, at least.</p>
<p>My translations of La Compiuta Donzella’s sonnets do not follow a literal phrase-by-phrase procedure, nor are they conventionally literary verse renderings. Instead, inspired by Caroline Bergvall’s Chaucerian re-visions in <em>Meddle English</em>, I opted for a sort of poetic archaeology, digging up buried idioms and lost meanings that were once common to the English and Italian vernaculars. At a practical level, this has entailed amplifying key words and abbreviating various others, as well as a certain amount of free association. I hope that parts of these translations will sound familiar to readers of Chaucer’s <em>Canterbury Tales</em>, Malory’s <em>Morte d’Arthur</em>, and anonymous early modern English and Scottish balladry.</p>
<p>The versions of the original texts reproduced here are drawn from Gianfranco Contini’s anthology <em>Poeti del Duecento: Poesia cortese toscana e settentrionale</em> (1960).</p>","<p>If she truly existed, (La) Compiuta Donzella was a thirteenth-century Italian poet who was the first woman to have written poetry in the Italian vernacular. However, some theorize that the poet was simply a creation of male poets, as there are no records of her existence other than her three sonnets. In this piece, she writes about her life and how she was torn between becoming a nun and succumbing to her father’s wishes to marry a man her father had chosen for her.</p>","<p>Samantha Pious is a graduate student in comparative literature and literary theory at the University of Pennsylvania. Her first book, <em>A Crown of Violets</em> (Headmistress Press, 2015), offers a selection of the French poetry of Renée Vivien in English translation. Some of her other translations and poems have appeared or are forthcoming in the <em>Berkeley Poetry Review</em>, <em>Mezzo Cammin</em>, <em>Queen Mob’s Teahouse</em>, and other publications.</p>",Italian,it,,,,,,,2016,submission
