pid,title,transtitle,author,translator,poem,transpoem,note,abio,tbio,language,lang,image,image2,imagecredit,imagecredit2,origaudio,translaudio,edition,pagetype
blind-scrap-dealer,اندھا کباڑی,Blind Scrap-Dealer,Noon Meem Rashid,Armghan Ahmad,"شہر کے گوشوں میں ھیں بکھرے ھوئے
پا شکستہ سر بریدہ خواب
جن سے شہر والے بے خبر!

گھومتا ھوں شہر کے گوشوں میں روز و شب
کہ ان کو جمع کر لوں 
دل کی بھٹی میں تپاؤں
جس سے چھٹ جائے پرانا میل
ان کے دست و پا پھر سے ابھر آئیں
چمک اٹھیں لب و رخسار و گردن
جیسے نو آراستہ دولھوں کے دل کی حسرتیں
!پھر سے ان خوابوں کو سمت رہ ملے 

""خواب لے لو خواب ۔۔۔۔۔۔۔۔۔۔۔ ""
صبح ھوتے ہی چوک میں جا کر لگاتا ھوں صدا ۔۔۔۔۔۔۔۔۔
""خواب اصلی ہیں کہ نقلی""
یوں پرکھتے ہیں کہ جیسے ان سے بڑھ کر 
خواب داں کوئی نہ ھو!

خواب گر میں بھی نہیں
صورت گر ثانی ھوں بس ۔۔۔۔۔۔۔ 
ہاں مگر میری معیشت کا سہارا خواب ہیں!

شام ھو جاتی ھے
میں پھر سے لگاتا ھوں صدا ۔۔۔۔۔۔۔
""مفت لے لو مفت، یہ سونے کے خواب ۔۔۔۔۔۔۔۔۔""
""مفت"" سن کر اور ڈر جاتے ہیں لوگ
اور چپکے سے سرک جاتے ہیں لوگ ۔۔۔۔۔۔۔۔۔۔
""دیکھنا یہ ""مفت"" کہتا ھے 
کوئی دھوکا نہ ھو!
ایسا کوئی شعبدہ پنہاں نہ ھو
گھر پہنچ کر ٹوٹ جائیں
یا پگھل جائیں یہ خواب
بھک سے اڑ جائیں کہیں
یا ھم پہ کوئی سحر کر ڈالیں یہ خواب ۔۔۔۔۔۔۔۔۔
جی نہیں کس کام کے؟
ایسے کباڑی کے یہ خواب
ایسے نابینا کباڑی کے یہ خواب!""

رات ھو جاتی ھے 
خوابوں کے پلندے سر پہ رکھ کر
منہ بسورے لوٹتا ھوں
رات بھر پھر بڑبڑاتا ھوں
""یہ لے لو خواب ۔۔۔۔۔۔۔۔""
اور لے لو مجھ سے ان کے دام بھی
خواب لے لو، خواب ۔۔۔۔۔۔۔۔۔۔
میرے خواب ۔۔۔۔۔۔۔۔۔۔۔
خواب ۔۔۔۔۔۔۔۔۔ میرے خواب ۔۔۔۔۔۔۔۔۔
خو ا ا ا ا ب ۔۔۔۔۔۔۔۔۔۔۔۔
ان کے د ا ا ا ا م بھی ی ی ی ۔۔۔۔۔۔۔۔۔۔۔۔۔""

","In the corners of the city are 
Scattered, broken, aimless dreams
Of which the city-dwellers are unaware.
I wander the corners of the city, morning and night,
So that I might compile them,
Reignite them in the forge of my heart, 
Clear off old, accumulated dirt,
So that their hands and feet may emerge again,
Their lips and cheeks and necks arise with a sparkle,
Like the unfulfilled desires in the heart of a newly adorned groom 
That these dreams may again find direction.

“Dreams, get your dreams—,”
As morning comes, I go to the square and give my call. 
“Are the dreams real or counterfeit?”
They investigate as if 
There were no greater authority on dreams than them! 

A maker of dreams, I am neither
A maker of the second face, nothing more
Although, yes, the backbone of my livelihood is dreams

Evening comes,
Again, I give my call 
“Free, completely free, these dreams of gold”
Upon hearing “free,” people become even more fearful
And wordlessly move away
“Watch out; ‘free’ he says, 
Might it be a hoax?
A hidden trick?
That they might break upon reaching home, 
Or that these dreams might melt,
Fly away in a puff of air,
Or perform some sorcery upon us,
Oh no! What use are they?
These dreams of a mere scrap-dealer,
These dreams of a sightless scrap-dealer!”

Night falls,
With stacks of dreams resting upon my head,
I return with a dejected expression,
All night I again murmur,
“Take these dreams…
Take more…and take from me their cost as well…
Dreams, take these dreams…
My dreams…
Dreams oh my dreams…
Dreams…
Even their cost”","<p>The translator’s dilemma is truly a world apart. On one hand, you feel the purest form of joy, sharing something so powerful and evocative to a whole new class of readers; on the other, you feel immeasurable loss for all the nuance and connotation that you somehow could not put on paper. There are questions every translator wrestles with: How true should one remain to source material versus the understood meaning of the work? Should line breaks happen as they are, or reflect the thoughts in the translated tongue? Is punctuation to be adjusted depending on the end language?</p>
<p>In translating Noon Meem Rashid’s <span lang=""ur"">اندھا کباڑی</span> (“Blind Scrap-Dealer”), I quickly came to realize that Rashid’s sonic mastery was something I would never be able to capture in my end product — I thus opted to keep the line breaks exactly where they were, to at least preserve the original form. Surveying the analogies and abstractions Rashid uses (likening his heart to a forge, to the sparkling dreams of a groom), I attempted to capture, more artfully, the larger metaphors he constructs.</p> <p>Choosing the tenses of the verbs in the first stanza was an active choice to highlight the narrative Rashid composes of the speaker himself reinvigorating the dreams. 
Additionally, the notion of “the second face” was difficult to explain. Simply put, “the second face” implies an external representation or symbol. Essentially, the speaker is asserting that he simply burnishes and presents these dreams, giving them an external appearance, but is not responsible for the content, the essence of the dream itself. I thought it more appropriate to footnote this explanation than to change the expression that Rashidr uses.</p> 
<p>Without a doubt, the most difficult part of translation was the title and the subject of the poem. <span lang=""ur"">کباڑ</span>, in Urdu, roughly translates to “scraps” or “rubbish,” and one who collects said scraps and sells them is a <span lang=""ur"">کباڑی</span>. In Pakistan, such individuals wheel around their goods, hawking their wares to people. Thus follows the plot of the poem: this scrap-dealer, whose call for dreams exists in the same form of a milkman, fruit-seller, or any other street merchant who might be passing through. It was not even that the equivalent word did not exist, but that the very concept did not exist in the English language or Western culture. Rather than alter the fabric of the work, I chose to include this explanation instead.</p>","<p>Noon Meem Rashid (<span lang=""ur"">نذر مُحَمَّد راشِد</span>, 1910–1975) was a Pakistani poet and writer noted for his progressiveness and rich, adventurous use of language. He served in the Royal Indian Army, and, after Independence, worked with Radio Pakistan before going on to work for the UN for the remainder of his career. Writing at a time when much of Pakistan’s literary community was harkening back to the Arab roots of Urdu, Rashid chose to highlight the Persian influence on Pakistan and Urdu. His language is layered with modern Persian verbiage and displays a mastery of sound that defies simple explanation. This very poem has a rhythmic rise and fall, a natural flow of language that rolls like honey off the tongue. Coupled with the abstractness with which Rashid examined the topics of free will, oppression, love, and beauty, his work emerged as the first marker of “modernist” Urdu poetry. Rashid also became the first prominent user of free verse in Urdu poetry, rebelling against the traditional <em>ghazal</em> format in Urdu poetry. He passed away in 1975, at the age of sixty-five, and asked to be cremated after his death (as opposed to the traditional Muslim burial), a hard-line individualist till the end.</p>","<p>Armghan Ahmad is a senior in Wharton studying finance and marketing. An avid lover of all things written, he can trace his passion for poetry to his family: to his grandmother, who would put him in her lap and regale him with stories and poems from her hometown of Agra, and to his parents, who would often quote poetry to each other at the dinner table and give him endless books to read. In his free time, Armghan enjoys taking photos, running along the Schuylkill trail, and waxing on about the cinematic masterpiece that is <em>Manchester by the Sea</em>.</p>",Urdu,ur,,,,,,,2019,submission
i-was-ten-years-old-head-in-the-sky,j’eus dix ans le ciel en tête,I was Ten Years Old Head in the Sky,Amina Saïd,<em>DoubleSpeak</em> Staff,"j’eus dix ans le ciel en tête
j’empruntai ses ailes au soleil
pour voler vers ce lieu entre deux rives

j’élevai des tours de sable
qu’habitait l’ombre qui me servait de corps

corps mûri par un soleil d’extrême été
j’étais dans la pensée du vent
les tons de la lumière
composaient mon paysage

j’étais dans la couleur du jour
je grimaçais avec les pierres
où s’abritaient les scorpions
dans l’île les femmes portaient un masque
peut-être par pudeur

le ciel en tête je me faisais invisible
pour mieux voir frappais aux vitres
où se rassemblait le jour
en un hymne quotidien
je cherchais un sens à la forme –
au-delà le monde devait exister

j’eus vingt ans impatiente
d’aborder des continents neufs
je quittai la maison de mon père
livrai à la lumière ma liberté d’oiseau
entrai dans l’espace de l’obscur

je cherchai à ouvrir des portes invisibles
affirmai lire la matière même du silence
comme une langue natale
fis du passé un commencement
et du présent une double absence

corps vivant plus que mort
je refusais que la nuit me sépare
du jour et le jour de la nuit

veilleur du rêve que le rêve invente
que cherchais-je lorsque j’ouvrais les yeux
sur les couleurs du monde
que jamais ne perd de vue le soleil

de la mémoire seconde des mots
naît l’émotion la plus réelle
j’habite cette musique
que je ne puis être seule à entendre

ombre qui suit ou précède son ombre
aux frontières entre rêve et réel
je demeure en marge de moi-même
dans l’espace et dans le temps

comment savoir si en ce lieu
de nulle part où se libère la voix
je suis venue de moi-même
ou s’il s’est imposé
","i borrowed the wings of the sun
to fly towards that place between two rivers

i raised towers of sand
in which lived the shadow that acted as my body

body ripened by the fervid summer sun 
the wind thought of me  
tones of light
composed my landscape

i hid in the shade of day 
i frowned with the stones
where scorpions sheltered
on the island, women wore masks
perhaps out of modesty

sky in the head, i would make myself invisible
for clear sight knocked on the windowpane
where it gathered the day
into a quotidian hymn
i was searching for meaning in its shape —
beyond, the world left existence

i was twenty years old impatient
to reach new continents
i left the house of my father
delivered my winged freedom to the light 
entered the space of the obscure

i looked to open the invisible doors
knowing to even read silence
like a mother tongue
making the past the beginning
and the double absence the present

body more alive than dead
i refused to let night separate me
from the day or the day from the night

watchman of the dream that the dream invents
what was i searching for when i opened my eyes
to the colors of the world 
that the sun never loses sight of

from the second memory of words
the most real emotion is born

i inhabit this music
which i can’t be the only one to hear

shadow which succeeds or precedes its shadow
upon the boundaries between dream and real
i dwell on the margin of myself 
in space and in time

how can i know if in this nowhere, 
where the voice frees itself,
if i came from myself
or was imposed.
","<p>This year, we include a chain translation done by the <i>DoubleSpeak</i> staff to demonstrate how many people can contribute to one translation. Each staff member translated about five lines, then we translated the last stanza together. We found it fascinating to watch the translation develop as each individual put in their own piece — aligning our own perception of the poem to the spirit of the poem itself <i>and</i> to others’ perceptions was challenging, but it allowed us to explore the boundaries of the self and others. We asked ourselves: How can we translate the poem’s focus on physicality? How can we capture the spirit of the language without any familiarity of its spirit? How would that spirit change our own expression?</p>
<p>The first line of the poem was difficult to translate. What exactly does it mean for one’s head to be “full of sky”? Is it whimsy at the nature of the world? A means of distraction? A reference to imagination and fleeting youth? Portrayals of nature’s beauty follow this “head in the sky,” with references to “wings of the sun,” “two rivers,” and “towers of sand,” alluding to nature’s magnificent power instead of the hands of humankind.</p>
<p>We also struggled with “I hid in the shade of day,” as the literal translation was “I was the color of day.” The sky is blue or white during the daytime but day seems like a colorless thing. So, we translated it as “I hid in the shade of day” because being the color of something colorless is the same as being invisible. Later in the stanza, the narrator mentions masks, so our translation makes the stanza more cohesive, even though the poem as a whole feels a bit fragmented.</p>
<p>Throughout the poem, the narrator grapples with her relation to the world around her. This is why we translated “j’étais dans la pensée du vent” — literally “I was in the thought of the wind” — as “the wind thought of me.” This decision places the narrator in a position of power: instead of being consumed by the wind, the wind makes the vulnerable decision to think of her.</p>
<p>Ultimately, through this process, we found ourselves each becoming a scrap of the translation and the poem becoming us.</p>","<p>Amina Saïd, born in Tunis in 1953, was raised by a Tunisian father and a French mother and grew up speaking both Arabic and French. A voracious reader of novels, Saïd began seriously writing after her middle school French teacher persuaded her to write poetry. She wrote poems throughout the remainder of her schooling and obtained her baccalaureate degree in Paris after moving to France with her family at the age of sixteen. Saïd continued to delve into the world of language during university, deciding to study English literature instead of forcing herself to choose between the literatures of her native languages. However, she still draws inspiration from both French and Arabic works. She started publishing her own poetry in her twenties and has translated novels by Francisco Sionil José. Her published works include collections of Tunisian folk tales and eight volumes of poetry which have been translated into Arabic, German, Italian, Spanish, and English. Honored in France with the Jean Malrieu Prize in 1989 and the Charles Vildrac Prize in 1994, Saïd has lived in Paris since 1978. She continues to write poetry and currently works as a journalist, often visiting her homeland of Tunis.</p>","<p><em>DoubleSpeak</em>’s editorial staff is a combination of strong individuals. We love translating and writing and eating cheese and desserts and fava beans and being with other strong language enthusiasts who translate and write and love. We come from Palm Beach Gardens, Florida; Lubbock, Texas; Dublin, California; Tampa, Florida; and Hangzhou, China; Bergenfield, New Jersey; Cortlandt Manor, New York; and Philadelphia. Between us, we speak Gujarati, Spanish, Mandarin, Korean, French, Japanese, Russian, Hebrew, Italian, and German. And we are forevermore mesmerized by the wonders of language, exploration, and discovery.</p>",French,fr,/assets/images/images_19/said.JPG,,photo by a <i>DoubleSpeak</i> staffer,,,,2019,submission
