pid,title,transtitle,author,translator,poem,transpoem,note,abio,tbio,language,lang,image,image2,imagecredit,imagecredit2,origaudio,translaudio,edition,pagetype
all-your-breakers-and-your-waves,כל משבריך וגליך,all Your breakers and Your waves,Dahlia Ravikovitch,Mira Revesz," וְרָאִיתִי אֲנִי אֶת דִּמְעַת הָעֲשׁוּקִים 
.הוֹלֶכֶת וּנְמוֹגָה עַל לֶחְיָם
וְרֵיחַ חַרְצִיּוֹת עָלָה מִן הַבְּקָעוֹת 
.עִם רֵיחַ שִׁטָּה רַעֲנָן 
וּמֵי נְחָלִים הִתְנַפְּצוּ עַל אֲבָנִים 
.בְּגַל שֶׁל שִׂמְחָה לְחִנָּם 
וְעַל שְׂפַת הַכִּנֶּרֶת הָיוּ מִתְרַחֲצִים 
.וְרוּחַ לֹא נָשַׁב עַל הַיָּם 
וְלֹא הָיָה מִי שֶׁיֵּלֵךְ עַל הַגַּלִּים 
.רַק הָמוֹן סִירוֹת וּמִשְׂחָקִים 
.וְרָאִיתִי אֶת דִּמְעַת הָעֲשׁוּקִים   
מִי שֶׁיִּרְצֶה לָקַחַת מִן הָאוֹר הָאוֹר 
.הוּא נַחֲלָתוֹ 
וְכָל אִישׁ יִהְיֶה חָפְשִׁי כְּמוֹ עָגוּר 
,לָלֶכֶת וְלָבוֹא 
מִלְּבַד אֶחָד 
.שֶׁהוּא שֶׁלִּי 
וְטוֹב לָעֵינַיִם לִרְאוֹת אֶת הָאוֹר 
וּמֵי הַנָּהָר כֹּה חָמִים וּמְתוּקִים וְ
דִמְעַת הָעֲשׁוּקִים 
.מָרָה 
","and I have seen the tears of the oppressed 
dissolving drop by drop on their cheeks —
and the scent of chrysanthemums 
rose fresh from the valleys
with the fragrance of acacia, opening, awake
and seas of streams shattered
 themselves upon rocks
in a wave born from unrooted joy —  
and on the shore of the Galilee 
there were bathers 
and no spirit blew across the sea
and nobody walked upon the waves,
only a tumult of boats, scouting and playing.

and I will have seen the tears of the oppressor – 
if you wish for a piece of Light, the light
is your own.
and each shall be free as a crane
to go and to come,
apart from the one
who’s my own.
and it is good for eyes to behold the light
and the stream of the sea is so warm and sweet 
and the tears of oppression so bitter.","<p>“all Your breakers and Your waves” was originally written in Hebrew by Dahlia Ravikovitch, an Israeli poet and peace activist born in 1936. At the time that Ravikovitch wrote, much of Israeli poetry was written in a mix of Biblical and Modern Hebrew, which meant that although I know no Modern Hebrew, the amount of Biblical Hebrew I’ve learned in the past two years gave me strong basis for understanding the poem.</p>
<p>In my translation, I chose to lift up ambiguities created by considering this text from the viewpoint of Biblical, rather than Modern Hebrew. The first is an ambiguity behind the word <span lang=""he"">העשוקים</span>, which in Modern Hebrew translates more directly to “the oppressed,” but in Biblical Hebrew can also simply mean “oppression.” At around the time I first read this poem, I began working with an activist organization in which we talked about how oppression works as a cycle in which oppressors dehumanize the oppressed and, in doing so, become dehumanized themselves, while those who have experienced oppression may more easily become oppressors. With this cycle in mind, I chose to translate this word differently each of the three times it appears in this poem — first as oppressed, then as oppressor, and lastly as oppression. As long as oppression exists, no one on any point of the spectrum can be fully human.  The other ambiguity centered around the tense of the verb in the first line of each stanza. In Biblical Hebrew, but not Modern Hebrew, verbs that begin with the prefix “and” oddly switch tense from past to future or vice-versa. This poem is written in the past tense, but because the two lines in question begin with “and,” to a reader of Biblical Hebrew, the tense would seem to be future. I chose to use both tenses, pairing the future, which to me communicates a prophetic yearning, with the translation of <span lang=""he"">העשוקים</span> as “oppressor” because although we may recognize and mourn oppression thousands of times across history, what will bring us true redemption will be reckoning with the oppressor and rehumanizing both sides.</p>","<p>Dahlia Ravikovitch (<span lang=""he"">דליה רביקוביץ</span>)was born in Ramat Gan, Israel, in 1936 and died in Tel Aviv, in 2005. She is one of the most well-known contemporary Israeli poets, peace activists, and translators, her primary language being Hebrew. Losing her father at an early age, she spent time in a <em>kibbutz</em> and then at several foster homes. She published her first book of poetry in 1959, called <em>The Love of an Orange</em>. Throughout her lifetime, she published ten volumes of poetry, which was translated into twenty-three languages. She has also translated the works of W.B. Yeats, T.S. Eliot, and Edgar Allan Poe into Hebrew. Many of her poems have been set to song and are well-known radio favorites in Israel.</p>
","<p>Mira Revesz is a senior majoring in Adolescent Identity Development at Swarthmore College. She fell in love with poetry when she first read Edna St. Vincent Millay’s work at age thirteen. At age nineteen, she alarmed surrounding passengers on a plane when she cried for an hour after reading that Millay died at the end of her biography (not a surprise ending). Mira entered the wild and contentious world of translation through Professor Taije Silverman's Translation of Poetry course, which was the best gateway she could have hoped for.</p>",Hebrew,he,../assets/images/images_16/ravikovitch.jpg,,photo by Shailly Pandey,,,,2016,submission
excerpts-from-va-ou,Extraits de <em>Va où</em>,Excerpts from <em>Va où</em>,Valérie Rezeau,Malika Kadyrova,"Quand je passerai je voudrais 
bien avoir de ma vie fait mon tour
Aimé aimé gratuitement passionnément 
et pas du tout aimé sans fin jusques au bout
Et encore maintenant toujours
Pour quand je m’en irai dormir 
comme il faut je rêve tous les rêves
J’envisage toutes les figures qu’elles 
rient rondes ou carrées ou pleuvent

~

Je me défends parce 
que je ne suis pas dure
Je me défends pour toi 
moi nous vous ils
Tout ce qui tire sur ma 
corde sensible pour me secouer
J’ai fait la liste des choses 
à oublier nous ne manquerons de rien
Les cloches pourront sonner 
au cou de la vie vache nous 
aurons le vin fou nous aurons le temps gai","When I go I’d like to have 
had my turn at my life
Loved to have loved freely passionately and not at all 
to have loved endlessly to the end
And still holding forever
Since when I leave to go to bed as 
I should I dream all the dreams
I picture all the faces they’re laughing 
round square or raining

~

I fight back because I am not tough
I fight back for you me us you they
Everything that pushes pulls on my heartstrings 
to undo me
I’ve made a list of things 
to forget we’ll want for nothing
The bells can ring on this dog’s life 
we’ll have our fool’s wine we’ll have a good time","<p>I have chosen particularly short excerpts here; these five-line extracts are tiny roller-coasters, especially considering Rouzeau’s tendency to forgo punctuation in order to create overlapping phrases within phrases. An interesting moment for me was in grappling with Rouzeau’s bells that could “sonner au cou de la vie vache.”  I had initially seen the bells as ringing “until the cows come home,” although that didn’t fully encompass the misery of <em>la vie vache</em>, which then became “a dog’s life.”</p>
<p><em>Va où</em> is a sprawling collection, and I am slowly translating and retranslating my way through it. I find that the poems hit me at a different angle every time and I find myself grasping them at different ends, which accounts for my sense of the <em>maintenant</em> in “encore maintenant toujours” as being closer – for me – to “holding” than “now.”</p>","<p>Valérie Rouzeau (1967–) is a French poet and translator. In 2012 she won the Prix Apollinaire for her collection <em>Vrouz</em>. Rouzeau’s poetry is adventurous and passionate; she works with neologisms, puns, and incorporates baby-talk in a fascinating blend of the adult poet’s and the little girl’s voices. Her language comes alive in a powerful stretch that engulfs the reader in the emotion conveyed.</p>","<p>Malika Kadyrova graduated from the University of Pennsylvania in 2015 with a major in comparative literature and minors in French and classical studies. She’s currently at Moscow State Institute of International Relations, wandering along the postgrad brick road in the direction of a career in simultaneous interpretation.</p>",French,fr,,,,,,,2016,submission
a-tree-in-blossom,《一棵开花的树》,A Tree in Blossom,Xi Murong,Tina Zhu,"如何让你遇见我 
在我最美丽的时刻　为这 
我已在佛前　求了五百年 
求佛让我们结这一段尘缘 

佛于是把我变成一棵树 
长在你必经的路边 
阳光下慎重地开满花朵 
朵朵都是我前世的企盼 

当你走近　请你细听 
那颤抖的叶是我等待的热情 
而当你终于无视地走过 
在你身后落了一地的 
朋友啊　那不是花瓣 
是我凋零的心","how can I let you come across me
in the moment I am most beautiful?        for this,
I have stood before the Buddha      pleaded for five hundred years
pleading for him to tie our earthly bonds together


and so the Buddha turned me into a tree
growing beside the path traced by your fate
now I flower fully in the sunlight
each blossom a longing from an old life

when you come close        please, listen carefully
that trembling of leaves is the passion I wait with
and when at long last you pass by, unknowing
what falls and covers the ground behind you


oh, my friend        those are not petals
they are my heart, withered away","<p>In translating Xi Murong’s most famous poem, my aim was to maintain the naturalness of the diction in the original without diminishing its sense of spirituality and emotion. In addition to deciding not to capitalize lines or add in more punctuation, I also kept the occasional extra spaces in the original, which I felt created more natural pauses without disrupting the flow of the poem. I wanted to capture the quiet desperation beneath her religious language and gorgeous imagery without veering into melodrama. It was a difficult balancing act, especially in the final two lines, where the speaker exclaims (or maybe sighs?) directly to the addressee with such vulnerability.</p>","<p>Born in 1943, Xi Murong (<span lang=""zh"">席慕容</span>) is a well-known Chinese poet and painter who comes from inner Mongolia and has ties to Taiwan. She is most famous for her poetry collections <em>Seven-li Scent</em> and <em>Unregrettable Youth</em>. Her style is subtle yet uninhibited, profound yet unpretentious, and deeply moving. Her work is influenced by ancient Eastern philosophy, and it often contains religious undercurrents that evoke the impermanence of human existence.</p>","<p>Tina Zhu is a senior at Swarthmore College studying cognitive and computer science. She grew up in Churchville, Pennsylvania, and Shanghai, China. She plays badminton, though not well, writes poetry and translations, and enjoys Girl Scout cookies and <em>The Office</em>.</p>",Chinese,zh,../assets/images/images_16/murong.JPG,,photo by Natalia Pleśniak,,,,2016,submission
as-i-wait-for-you,너를 기다리는 동안,As I Wait for You,Hwang Ji-woo,Jin Ah Lee,"너를 기다리는 동안 - 황지우

네가 오기로 한 그 자리에

내가 미리 가 너를 기다리는 동안

다가오는 모든 발자국은

내 가슴에 쿵쿵거린다

바스락 거리는 나뭇잎 하나도 내게로 온다

기다려본 적이 있는 사람은 안다

세상에서 기다리는 일처럼 가슴 에리는 일이 있을까

네가 오기로 한 그 자리, 네가 미리 와 있는 이곳에서

문을 열고 들어오는 모든 사람이

너였다가

너였다가, 너일 것이었다가

다시 문이 닫힌다

사랑하는 이여

오지 않는 너를 기다리며

나는 마침내 너에게로 간다

아주 먼 곳에서 나는 너에게 가고

아주 오랜 세월을 다하여 너는 지금 오고 있다

아주 먼데서 지금도 천천히 오고 있는 너를

너를 기다리는 동안 나도 가고 있다

남들이 열고 들어온 문을 통해

내 가슴에 쿵쿵거리는 모든 발자국을 따라

너를 기다리는 동안 나는 너에게 가고 있다

(1990년作 시집 '게 눈 속의 연꽃' 수록)","As I arrive early and wait for you

at the place where you promised to be,

every step that approaches

strums my heart.

Even a rustling leaf steps toward me.

Anyone who has waited for someone knows

that there is nothing in this world that makes one’s heart ache as much.

Every person who opens the door and walks in,

into the place where you promised, where I arrived early,

was you,

probably you, perhaps you,

then the door closes again.

My beloved,

as I wait for you who do not come,

I come toward you at last.

I come toward you from a very far place,

and now you come toward me, as you have for a very long time.

As you approach from far away, slowly even at this very moment,

I come closer to you as I wait for you.

Through the door that others opened,

tracing every step that strums my heart,

I come closer to you as I wait for you.

(From <em>Lotus Flower in the Eyes of a Crab</em>, 1990)","<p>Some poems are devised while others are improvised. This poem is the latter. In an interview, Hwang revealed that he wrote the poem in five minutes when his journalist friend asked him to write a piece for a teen magazine. Although he forgot about writing the poem, it became one of his best-known works after being recited on a radio show. The poet himself was ashamed of the poem for a while because of its “cheesiness,” but many readers could certainly relate to the excitement and frustration of waiting for someone or something dearly, and saw themselves in his writing. As you know, not all literature needs to be sophisticated. Some just brings you back to a different time and a different space.</p>","<p>Hwang Ji-woo (<span lang=""ko"">황지우</span>) is a famous twentieth-century poet from South Korea. He developed an interest in poetry after studying aesthetics and philosophy at two notable universities, Seoul National University and Sogang University. After fulfilling his military duty, he was expelled from university for participating in political protests against the Korean government. His political activism influenced his poetry to the extent that he has written poems to deliver his political message. His poems are also influenced by Buddhist philosophy, most likely as a result of his philosophy studies at Sogang University. He is one of the leading figures of the deconstruction poetry movement of 1980s Korea with his unique way of utilizing satire and depicting absurdity through experimental approaches. On the other hand, the general public is more fond of his talent for grasping ordinary moments with fine sensitivity — this poem is a good example.</p>","<p>Jin Ah Lee is a graduate of the Integrated Product Design Program at Penn and is currently working as a startup consultant in Los Angeles. She has always been interested in learning new languages, and she considers language not only as a medium through which to communicate but one that expands her horizons. As a child, she learned English by singing Disney songs, and now thanks <em>DoubleSpeak</em> for helping her continue to revisit her passion for cross-cultural connection through her contribution to the magazine.</p>",Korean,ko,,,,,,,2016,submission
to-an-oak,致橡树,To an Oak,Shu Ting,Johnathan Zheng,"我如果爱你——
绝不像攀援的凌霄花，
借你的高枝炫耀自己；
我如果爱你——
绝不学痴情的鸟儿，
为绿荫重复单调的歌曲；
也不止像泉源，
常年送来清凉的慰藉；
也不止像险峰，
增加你的高度，衬托你的威仪。
甚至日光，
甚至春雨。
不，这些都还不够！
我必须是你近旁的一株木棉，
作为树的形象和你站在一起。
根，紧握在地下；
叶，相触在云里。
每一阵风过，
我们都互相致意，
但没有人，
听懂我们的言语。
你有你的铜枝铁干，
像刀，像剑，也像戟；
我有我红硕的花朵，
像沉重的叹息，
又像英勇的火炬。
我们分担寒潮、风雷、霹雳；
我们共享雾霭、流岚、虹霓。
仿佛永远分离，
却又终身相依。
这才是伟大的爱情，
坚贞就在这里：
爱——
不仅爱你伟岸的身躯，
也爱你坚持的位置，
足下的土地。","If I love you –
I’ll never resemble a trumpet vine,
borrowing your branches to flaunt myself;
 
If I love you –
I’ll never imitate a lovebird,
repeating songs for cool shade;
 
and more than a wellspring,
providing solace year-round;
and more than a mountain peak,
lifting your outlines, proclaiming your majesty;
even sunlight
even spring showers;
no, these are not enough!
 
I have to be a kapok tree by your side,
standing with you, vivid.
Roots, clasp firmly underneath;
Leaves, touch the clouds together.
With every passing gust of wind,
we nod to each other,
and no one
can catch what we are saying.
 
You, with your copper branches and iron trunk
like knives, swords, and halberds.
I, with my red-hot flowers
like heavy sighs,
gallant beacons.
 
We share the burden of cold, thunder, and lightning.
We share the joy of fog, mist, and sun rays.
Forever seeming separate,
yet harmonious. Root-bound.
 
This is the greatest love of all,
faithful throughout:
Love –
I love not only your steadfast stature,
but also your enduring state. 
The land beneath you.","<p>Shu Ting is known to be a very private individual, so her poetry is really the only way she expresses herself. I chose this poem because I really love the imagery and the challenges associated with translating such rich details. Some have said that this poem represents a young woman's love.</p>","<p>Born in 1952, Shu Ting (<span lang=""zh"">舒婷</span>)is a famous Chinese poet. She grew up during the Cultural Revolution, a movement that called for the destruction of the “Four Olds,” one of these four being culture. Forced to work in a factory, she rebelled against the government by writing poetry. Her reputation grew through poems she published from 1969 and onward in the underground journal <em>Jintian</em> (“Today”). Shu Ting came to be associated with what we know as “The Misty School” of Chinese poets, so named by the government for their obscure or “misty” qualities but now one the most internationally acclaimed movements in modern Chinese literature. She was eventually invited to join the official Chinese Writers’ Association, and she won the National Outstanding Poetry Award in both 1981 and in 1983.</p>","<p>Johnathan Zeng is a recent graduate of the University of Pennsylvania (Class of 2016) who studied bioengineering. Currently, he is in China working on a project analyzing the risk factors of lung cancer for ethnic minorities.</p>",Chinese,zh,,,,,,,2016,submission
