pid,title,transtitle,author,translator,poem,transpoem,note,abio,tbio,language,lang,image,image2,imagecredit,imagecredit2,origaudio,translaudio,edition,pagetype,wrapformat
kaise-kahoon-how-do-i-say,,<em>Kaise Kahoon</em> / How Do I Say?,Simran Chand,,,,"<p>As a heritage speaker, I can easily navigate nonchalant conversations about the usual suspects:  the frigid nature of gray Philadelphia winters, the heinous pile of chemistry homework that awaits me, the satisfying taste of my morning Metropolitan Bakery bagel, and the like. It is usually the pretentious, sophisticated words that elude me. Though reading and writing Hindi at a fourth-grade level and being conversationally fluent may seem like a masterful feat, I struggle to  maintain conversations with my own flesh and blood. I wish to discuss politics with my relatives;  I want to empathize with their emotions; I hope to understand their life histories. While my thoughts and abilities to express myself in English have grown from a liberal arts college education, my Hindi lags far…<em>far</em> behind. As my mind races ahead and the conversation continues forth, my lips are still floundering to summon seemingly simple words. My vocabulary  precludes me, and those opportunities to connect remain far out of reach. </p>
<p>Beyond seeking deeper connections through conversation, there is also the matter of discussion topics riddled with taboo. Communicating about uncomfortable subjects is difficult enough in one’s native tongue, so how does a second-generation Indian American girl who has just lost her virginity ask her mom about “emergency contraception”? How does a prepubescent Sikh boy discovering his sexuality question “masturbation” in Punjabi? If I struggle to remember the  Hindi translations for “government” or “calendar,” how can I possibly conjure a translation for  “intimacy” or “consent”? To this day, I have not heard anyone say the Hindi word for “sex.” Translations aside, do certain words even exist? What is “lesbian” or “orgasm” or “foreplay”? I  could not tell you, nor do I feel comfortable asking the people in my life who could perhaps enlighten me.</p>
<p>Delving into this notion further, what does this mean for the cultural phenomenon colloquially known as the “sex talk”? Parents brought up in the United States awkwardly struggle to teach their children about puberty and sex — or some abstain from it altogether and allow school systems to handle the task — but at least there is a shared language between parent and child that confers some level of openness to sexual communication channels. Even if it is not discussed, American television shows, films, books, and social media tell us about cherries popping and sixty-nining. These are words I can put to paper, and regardless of how squeamish they may make the reader, the concept is understood. How does a Muslim American girl tell her immigrant mother she had premarital sex and discovered she has a pelvic floor disorder requiring gynecologic therapy? How does a Tamil American boy still on his parents’ health insurance explain to them that he is gay and wishes to begin HIV prevention medication? There is perhaps an inherent timidness for a child to reveal their sexual activity to a parent that is only heightened when we add elements such as religious transgression, compulsory heterosexuality, culturally rooted stigmas, and a complete lack of language equivalency through which a child of immigrants might make their parents understand.</p>
<p>Let us extend this further to gender identity or sexual orientation. A young person struggling with their gender identity can attempt to put into words what they feel.  They can utilize vocabulary such as “queer,” “nonbinary,” or “transgender” to effectively communicate their non-heteronormative identity. What does a young South Asian American individual do? They do not have a cultural equivalent in their parents’ native tongue to help them understand this identity, let alone the verbiage to express it. There are other non-heteronormative identities native or known to South Asia, including <em>hijra</em> in Hinduism or <em>khuntha</em> in Islam, but what is queerness? Not only is there a lack of word equivalents, but also a lack of cultural equivalents. How does this person explicate to their South Asian-born parents what exactly they feel — who exactly they are?</p> 
<p>And yet, we cannot blame. There is no one and nothing to blame. There is only the simple fact that the key understandings in American culture communicated through English are distinct from understandings in South Asian culture that are communicated through Hindi, Urdu, Punjabi, Marathi, Telugu, and other languages and dialects in India, Pakistan and other regions. The messages are quite literally lost in translation. Unfortunately, the potential impacts of this are far-reaching and truly ominous. Initially, insufficient sexual education and closed communication channels can result in inexperience, discomfort, and confusion. Then perhaps experimentation and promiscuity for some, but repression and deep-rooted fear for others. What next? Lying, rebellion, broken family ties.  Insecurity, miscommunication, unmet desires. The ultimate manifestation involves a myriad of documented experiences with negative impacts to individuals’ sexual, mental, and physical well-being: lack of access to birth control, verbal abuse, struggles to receive the HPV vaccine, hidden sexual orientations, misinformation given to medical providers, and broken households.</p> 
<p>And somehow, it can all be traced back to not knowing how to even say “sex.”</p>
","<p>
Simran Chand recently graduated from the University of Pennsylvania in December 2021, double-majoring in biology and Gender, Sexuality, and Women’s Studies. She grew up speaking Hindi and English simultaneously, simply through exposure to her parents’ native tongue. She took Hindi grammar lessons through her early years of high school with Kishori Barman, a passionate resident of Newtown, Connecticut, committed to teaching the surrounding area’s  South Asian youth the beauty of the Hindi language. With a vested interest in ethnic identity,  gender/sexuality, and healthcare, Simran is the author of an honors research thesis documenting trends of familial sexual education amongst South Asian Americans at Penn. Simran plans to attend medical school while continuing to investigate the intersections of identity and medicine.
</p>",,English,en,/assets/images/images_22/musing1.jpg,../assets/images/images_22/musing2.jpg,photo by Stacy Shimanuki,photo by Stacy Shimanuki,,,2022,musing,
reaching-for-words-on-gottschee,,Reaching for Words: On Gottschee,Quinn Gruber,,,,"<p>In December 2017, my Onkel Helmut passed away at the age of eighty-four. He was stern, yet jovial, with a round and kind face. He, my Tante Resi, my sister, and I would often go on walks in the park in Queens and have simple lunches of hard-boiled eggs, ham, and bread. Occasionally, he taught me bits of German, like the slogan written on the thin yellow tag of a Steiff teddy bear: <em>Knopf im Ohr, “button in ear.” After the funeral, we all went somberly to eat together at a place called Gottscheer Hall. My mother told my sister and I that Onkel Helmut, like the rest of my father’s side of the family, was from a place called Gottschee. Sitting in the car, trying to wrap my head around the pronunciation of the name, I reevaluated my family’s history. My father always told us that our family was from Germany. Stray German words flit through our conversations, like <em>schlafen</em> (“to sleep”) and <em>Schatz</em> (an endearment, literally “treasure”). Yet, my Oma and Auntie’s immigration papers list Yugoslavia and Austria-Hungary as their countries of origin. I always felt that I lacked some crucial piece of information that would bring all these scattered bits of history and culture together — Gottschee was that keystone.</p>
<p>Pieces of my family’s story slowly came forward as I read about Gottschee’s history. Gottschee was a small region in present-day Kočevje, Slovenia, that Germanic farmers settled in the thirteenth century. Their language, Gottscheerisch, is a dialect of medieval German; Gottscheers, like my Onkel Helmut and my grandmother, could speak German, but a German speaker couldn’t understand Gottscheerisch. Gottscheers used German in business contexts and spoke Gottscheerisch at home, a linguistic island surrounded by Slovenian-speaking neighbors. This linguistic fluidity mirrors the confusion surrounding the Gottscheers’ identity, as clashing empires passed the county back and forth over the course of its history. Outside observers and Gottscheers themselves have identified Gottscheers as German, Austrian, Slavic, yet also as an entirely distinct people. I understand why my father never mentioned Gottschee — I don’t know how to talk about it without giving a history lesson. The most important part of this history begins in 1918, when Gottschee became a part of Yugoslavia after the fall of Austria-Hungary. Gottschee’s few colleges were closed, and Slovenian became the county’s only official language, although due to many children’s complete lack of understanding of Slovenian, public school instruction was eventually conducted half in German and half in Slovenian. Gottschee soon changed hands again, however, with much more severe consequences for its people.</p>
<p>Soon after the beginning of WWII, in 1941, Italy annexed the southern part of Yugoslavia, which included Gottschee. My Tante Berta Kropf, who lived in Gottschee during the annexation, wrote that the Gottscheers received an ultimatum that they either needed to assimilate into Italy or move to Germany. Propaganda promising prosperity in Nazi Germany, some of it spread by Gottscheer leaders, and the threat of cultural erasure forced nearly all the Gottscheers to comply. They soon found, however, that they were not relocated to Germany, but to Lower Styria (near the current border of Croatia), into the homes of Slovenians who were taken to Nazi labor camps. They left the farms they had cultivated for centuries to find themselves forced into often-cramped conditions with little land. I’m sure that part of why my father never mentioned Gottschee is the Gottscheers’s role, although unwilling, in Nazi Germany’s atrocities against Slavs. I sit and wonder how many Gottscheers genuinely believed in Hitler’s Pan-Germanism, and how many simply followed their relatives and neighbors or felt that they had no choice but to leave. Yet the Nazi Party also banned the use of Gottscheerisch, seeking to fully Germanize the Gottscheers and to erase their culture.</p>
<p>Their fragile living in Lower Styria was upended again at the end of WWII, when Nazi Germany was expelled from Yugoslavia. The Gottscheers had no right whatsoever to stay, but they were not allowed to return to their homes in Gottschee, as it became part of Yugoslavia. The Anti-Fascist Council for the Liberation of Yugoslavia (AVNOJ), led by Josip Broz Tito, held all ethnic Germans, including the Gottscheers, responsible for Nazi Germany’s crimes during the war. Gottscheerisch and German were banned permanently, replaced by Slovenian. In 1945, the Department for People’s Protection (OZNA) carried out a campaign to eradicate or evict ethnic Germans living in Yugoslavia. Thousands of Gottscheers and other ethnic Germans were held in the Sterntal concentration camp, located in present-day Kidričevo, Slovenia, where two to seven thousand people died. In addition, around eight to twelve thousand Gottscheers were stripped of their possessions and land and marched to Austria in August 1945. About three thousand people died on the march; those who survived were placed in overcrowded refugee camps in Austria. I wonder, too, what it must have felt like for the Gottscheers, most of whom wanted no affiliation with Germany whatsoever, to be forced to move, then to be treated brutally by the OZNA, only to be rejected as outsiders in Germany and Austria. Some Gottscheers remained in Gottschee — particularly those who had agreed to fight with the Yugoslavian partisans — some stayed in Austria, some went to Canada, but most immigrated to the United States. And even there, many Gottscheers were received with hostility; my grandmother, who was born in New York but spoke German as a first-generation Gottscheer American, was frequently called a Nazi by her classmates; meanwhile, her relatives were suffering because of Nazi Germany’s crimes.</p>
<p>As I continued reading about Gottschee, I discovered an old, spineless book entitled <em>Gottscheer Gedenkbuch</em> (<em>Gottscheer Memorial-Book</em>) tucked away in the back corner of my family’s office. Its light blue cover, embossed with the city seal of Gottschee, was held on by the oldest-looking masking tape I’ve ever seen. On the title page, it reads: “Herausgegeben un mit dem Reingewinne dieses Buches dem in Not befindlichen Gottscheer Folk zu helfen.” “Published to help the Gottscheer people in need with the book’s net profit.” Many Gottscheers immigrated to Brooklyn and Queens or the Midwest at the turn of the twentieth century and established a variety of Gottscheer cultural associations to preserve a sense of community in the States. These Gottscheers, as a part of the Gottscheer Relief Association, wrote and sold the memorial-book to raise funds for the Gottscheer refugees after WWII; my Tante Kropf writes gratefully of the clothing and food her family received. I don’t know which of my relatives purchased this book — my father didn’t even know we owned it — but I can find many of my relatives’ names in the lists of hundreds of Gottscheers who settled in the United States. Written in German and English, it comprises writings on Gottschee, information on the various Gottscheer organizations in the United States, and advertisements for Gottscheer businesses. I’m still struck by how much care was put into compiling the book, which included even people’s old house numbers back in Gottschee, so you might recognize a neighbor even if you forgot their name.</p>
<p>Even as it seeks to preserve Gottscheer history and culture, however, the <em>Gottscheer Memorial-Book</em> rings a sense of inevitable loss. In the words of John Kikel, a lawyer from Ridgewood, Queens, who led the Gottscheer Relief Association, Gottscheerisch “dies with the first generation.” The pressure to Americanize, to stop speaking your own language and celebrating your own culture, is difficult to resist, especially as new generations are born. But what happens to a language and a culture when a home country no longer exists to maintain it? When the Gottscheers immigrated to the States, they accepted that with the loss of their country came the loss of their language. My grandmother was the last person in my close family who spoke Gottscheerisch; she passed in April 2018, soon after my Onkel Helmut. I know that Americanization has significantly benefited my family. Whiteness, especially American whiteness, opens innumerable doors and protects me from facing opposition due to other facets of my identity. But I feel a deep grief when I think about the fate of Gottschee and Gottscheerisch. I had barely discovered my ancestry, only to find that my family’s language is nearly extinct. I still don’t know what to say to people when they ask me where my family is from. Do I explain? Do I call myself German, which is accurate and not at the same time? Is it even relevant to me, three generations removed from my great-grandparents who immigrated here? I remember once telling my Tante Resi that I wanted to learn German. She told me I didn’t have to, and though she didn’t say it, I heard the hidden meaning — you live in the United States. You only need English. Yet I feel like something’s missing; I reach for a language I need to speak but I will most likely never learn.</p>
<p>Gottscheer Hall shows that there’s still a Gottscheer community in the United States, but most estimate that only one hundred Gottscheerisch speakers are still alive. I know that I will never learn to speak Gottscheerisch, no matter how much I wish I could go back in time and cajole my grandmother into teaching me. But I can learn from what others have written and record my own family’s stories. It is most likely too late to save Gottscheerisch outside of books, but it might not be too late for us to record, listen to, and learn from speakers of other minority languages. Colonialism, the pressure of assimilation, the ease of communication through digital media, and the growing dominance of English and a select few other languages all threaten the extinction of at least half the world’s languages by 2100, according to UNESCO. Entire cultures and histories live inside every language. Organizations like Wikitongues, the Endangered Languages Project, and language schools established by Native/Indigenous peoples and other minority language speakers are doing crucial work to keep endangered languages alive. As people living in an increasingly interwoven world, we must do what we can to carry our own histories and languages forward and to reckon with the pain, but also the comfort and joy, that they bring. That’s how we stay alive.</p>

<p>(I gathered much of the history recounted above from the <em>Gottscheer Memorial-Book</em>, Tante Kropf’s account, “An Homage to the Quiet Heroes who were our Parents,” a 2015 Smithsonian article on Gottschee by Daniel Gross, and information on Gottschee from the Gottscheer Heritage and Genealogy Association and Gottscheer Hall. For a short overview of the Gottscheerisch language written in English, John Dyneley Prince, the ambassador to Yugoslavia at the time, wrote an article in 1931 called “The Gottschee Germans of Slovenia” that articulates many of the grammatical differences between Gottscheerisch and German. There are also many German-language resources on Gottschee available online.)</p>","<p>Quinn Gruber is a senior at the University of Pennsylvania studying English and Italian. Right now, they’re thinking a lot about the poet Margherita Guidacci (whose first book, <em>The Sand and the Angel</em>, they translated for their creative writing thesis), James Joyce, and, more broadly, the intersections of science and literature. When they aren’t reading or writing, they’re knitting, sculpting very tiny things, and collecting other hobbies. They unironically enjoy dancing and listening to polka. Their favorite possession is a wooden darning mushroom that belonged to their Oma, which reads in German: “When boys won’t leave you alone, stay at home and darn socks.”</p>",,English,en,/assets/images/images_22/gruber.jpg,none,photo by Quinn Gruber,,,,2022,musing,
