pid,title,transtitle,author,translator,poem,transpoem,note,abio,tbio,language,lang,image,image2,imagecredit,imagecredit2,origaudio,translaudio,edition,pagetype,wrapformat
i-too-am-a-riddle,प्रिय! मैं हूँ एक पहेली भी,"I, Too, Am a Riddle",Mahadevi Varma,Anjali Gupta,"प्रिय! मैं हूँ एक पहेली भी !

जितना मधु जितना मधुर हास
जितना मद तेरी चितवन में
जितना क्रन्दन जितना विषाद
जितना विष जग के स्पन्दन में
पी पी मैं चिर दुख-प्यास बनी
सुख-सरिता की रंगरेली भी !

मेरे प्रतिरोमों से अविरत,
झरते हैं निर्झर और आग;
करती विरक्ति आसक्ति प्यार,
मेरे श्वासों में जाग जाग;
प्रिय मैं सीमा की गोदपली
पर हूँ असीम से खेली भी !","My love, I, too, am a riddle.

The nectar, the honeyed laughter, 
The lust in your glances, 
The lamentation, the despair, 
All the poison in this quivering world.  

I drink, I drink it all, and yet I thirst for sorrow 
And bathe in the river of joy. 

From every fiber of my being 
Both the fire and water fall. 
Renunciation and devotion join 
In my panting breath. 

My love, I was born to the lap of limitation,
But I, too, have loved in the limitless.","<p>This poem speaks to me of duality, conflict, and devotion. I really wanted to convey the complexity and confusion in this poem. There is a palpable tension and urgency that needs to be prioritized. </p>
<p>As in all translations, I had to compromise. I struggled with the translation of <span lang= ""hi"">प्रिय</span> (<em>priya</em>), appearing as both the poem’s first word and towards the end. The whole poem hinges on this one word. Because it is a direct address, it sets the tone for the poem and makes it an intimate conversation. Previous translators conveyed this as “beloved,” and “dear one.” These felt antiquated and awkward to me. I chose to translate this as “my love” because it felt more colloquial and like a gentle whisper. </p>
<p>Another thing I struggled with is the loss of linguistic and cultural ancestors when words are dragged from Hindi to English. For example, in line 3, the word <span lang= ""hi"">मद</span> (<em>mad</em>) means something along the lines of “intoxicant,” “frenzy,” and “lust” and has visual connotations of liquid oozing. I could not find the elusive perfect word in English. When words are used, historical and cultural histories are invoked. As I have supplanted this poem across languages, the history and culture is altered. As the poet draws on mythologies and literature, I straddle the line between truth to tradition and to the flow of the narrative.</p>
<p>I present this translation from a place of vulnerability. As a third-generation American, I am not a native speaker of the language that my grandparents speak and that I am translating here. I can only promise that I have chosen each word, down to the syllable, with the utmost care and with the loving help of my grandmother.</p>","<p>Born in 1907 in India to a liberal family, Mahadevi Varma was a poet, feminist, and scholar. She attended the Crosthwaite Girls College at Allahabad and graduated in 1929. Her first poetry collection was published in 1930; she went on to publish seven other works as well as an extensive selection of prose. Over the course of her literary career, she received numerous awards including the Padma Bhushan and the Jnanpith Award. She was an essential figure in the Chhayavad school of Hindi literature. </p>
<p>She is a greatly lauded figure for her work in poetry and advocacy and is accredited with drastically revolutionizing women’s education in her time. She pushed for modernity and enacted positive change in all aspects of her life. </p>","<p>Anjali Gupta is a senior at the University of Pennsylvania studying linguistics. She intends to pursue a career in healthcare and is passionate about the patient-doctor interaction and translating untranslatable experiences in the biomedical space. She enjoys baking, going for walks with her friends, and practicing her Hindi with her grandparents.  </p>",Hindi,hi,/assets/images/images_22/varma.jpg,none,photo by Yan Zhang,,,,2022,submission,
you-dont-raise-children-to-watch-them-die,NO SE CRÍAN HIJOS PARA VERLOS MORIR,YOU DON’T RAISE CHILDREN TO WATCH THEM DIE,Rosabetty Muñoz,Claudia Nuñez de Ibieta,"                                                             Cuando el mar se llevó a sus tres hijos Ella
                                                             estaba acodada en la puerta de su casa, pensando 
                                                             en ollas aladas y repletas. De pronto cayó en 
                                                             un vacío del que surgió vieja y encorvada. No 
                                                             necesitó entrar para vestirse de negro. Ya estaba 
                                                             recogiendo ﬂores cuando salió su hombre con la 
                                                             radio en la mano, desamparado y tembloroso.


Ella es una sábana ﬂotando sobre nosotros.
Nada detiene el remolino que alienta su vuelo.
Desde su vientre deshabitado
los ovarios violeta se abren como ﬂores nocturnas.
La ansiedad es un arrecife
donde acerados corales hieren los cuerpos amados.

Sin hijos bajo sus ojos
quisiéramos las madres
ofrecerle un trozo de pañal
para vendar sus muñones o un arca
donde recoger los salados restos.
","                                                             When the sea took away her three sons She 
                                                             was leaning in the doorway of her home, thinking 
                                                             of winged and brimming pots. Suddenly she fell into
                                                             an abyss, from which she emerged old and hunched. She didn’t 
                                                             need to go inside to be dressed in black. She was already 
                                                             gathering flowers when her husband came outside with the 
                                                             radio in his hand, helpless and trembling.
 
She is a sheet floating above us.
Nothing restrains the whirlwind that keeps her aloft.
From her deserted womb
violet ovaries unfurl like night-blooming flowers.
Anxiety is a reef
where sharpened corals wound beloved bodies.

Without children in her sight
we mothers would like
to offer her a piece of diaper cloth
to bandage her stumps or an ark
to gather the salty remains.
","<p>This poem originally appeared in <em>Hijos</em> (<em>Children</em>, 1991), a sublimely beautiful collection of Muñoz’s poems centered around pregnancy and motherhood. This image-rich, heart-aching piece — the final poem in the collection — is based on a real event from the time. In a historical context, such tragedies occur all too often in the maritime culture of Chiloé, as perhaps they do in other places, and the individual loss and grief conveyed become universal in significance. The particular language and imagery of Muñoz’s poetry, however, is specific to the culture, lore and landscape of the Chiloé archipelago, and is one of the most essential elements throughout her entire body of work.</p>
<p>We learn of the tragic loss in the first line and throughout the first stanza. In robbing her of her children, the sea not only took them — <em>se los llevó</em>, but “took them away”; the line becomes more similar in length to the original and emphasizes the loss. While their mother leaned in the doorway, awaiting their safe return and anticipating a successful catch, the pots of fish and seafood stew she was already planning would not merely be full, but <em>rebosantes</em> — “brimming” in joyous abundance. The traditional clay pots, with handles like folded “wings,” embody the magic of the hearth, the reward for such hard, often dangerous, labor at sea. She is endowed by the poet — a mother of three herself — with a powerful, unquestionable sense of maternal intuition. She somehow knows and feels the ultimate loss before her husband hears the tragic news reported on the radio. An abyss of devastation swallows her and spits her out, shrunken and aged. In a traditional culture not unfamiliar with tragedies at sea, it isn’t odd that she is already “dressed in black” and “gathering flowers” by the time he comes outside, “helpless and trembling.”</p>
<p>The second stanza addresses not only the mother in the first stanza, but all grieving mothers, forever unmoored. In the second line, my approach to translating the image into English resulted in a more adaptive choice. From the original, “nada detiene el remolino que alienta su vuelo,” <em>remolino</em> can mean a whirlpool or a whirlwind. Instead of the more obvious reference to water, I chose the reference to air, for its connection to the rest of the phrase, <em>que alienta su vuelo</em> (“that encourages her flight”), and settled on “nothing restrains the whirlwind that keeps her aloft.”</p>
<p>Without children of her own in sight, she is maimed forever by the loss. The other mothers know there’s no possible consolation, but can only offer gestures of compassion.</p>","<p>Rosabetty Muñoz is a Chilean poet and teacher from the southern city of Ancud, on the island of Chiloé. Her lifelong dedication to both poetry and education are matched by her dedication to the people and places she has always known, and always refused to move away from. Her entire body of work is infused with and inspired by Chilote landscape, culture and legends, as well as the inevitable, present-day clash of changing cultures. Passionate about language, she seeks to inspire her students, and her readers in general, to become enchanted by the words they hear. Her own voice has been described as uncomplicated, often minimalist in appearance, yet deeply metaphysical and complex, sounding at times almost like a prayer or a hymn that moves the reader into a contemplative state. Her titles include <em>Canto de una oveja del rebaño</em>, <em>En lugar de morir</em>, <em>Hijos</em>, <em>Baile de señoritas</em>, <em>La santa: Historia de su elevación</em>, <em>Sombras en el Rosselot</em>, <em>Ratada</em>, <em>En nombre de ninguna</em>, and the anthology <em>Misión circular</em>. Her work has appeared in international anthologies, and has claimed many notable prizes, including the Pablo Neruda Prize and the Altazor, among many others. She has also been named a member of the Academia Chilena de la Lengua.</p>","<p>Claudia Nuñez de Ibieta translates and interprets within Spanish and English. Past work includes various translation projects for Chilean television, as well as historical translation for the Academy of American Franciscan History. More recently, she has translated short fiction and poetry, with work appearing in Harpy <em>Hybrid Review</em>, <em>DoubleSpeak</em>, and at <em>www.fiikbooks.org</em>, where she participates in collaborative group translation projects. Also a member of the <em>Cardboard House Press Cartonera Collective</em> in Phoenix and a long-time bookseller, she grew up in Los Angeles, California, and Santiago, Chile, but Tempe, Arizona, has been her home the longest.</p>",Spanish,es,none,none,,,"<div>

<iframe
  frameborder=""0""
  width=""375""
  height=""65""
  src=""https://drive.google.com/file/d/1k33TmXe1FCr_np2FV10xp9TqY9jMuxH6/preview"">
</iframe>
</div>","<div>

<iframe
  frameborder=""0""
  width=""375""
  height=""65""
  src=""https://drive.google.com/file/d/13Xxcmkc0LFk7XPVkdFPcUzg2JYruCbux/preview"">
</iframe>
</div>",2022,submission,
unwavering,Manteniéndome firme,Unwavering,Zoraida Armengol,Pablo Abrante,"Para que no se enojen
las musas de las avenidas,
escribo en mis tiempos libres;
para mantenerme viva.

Para que no se aleje
el salitre con alas vistiendo,
escribo sobre el hermoso encanto;
para seguir existiendo.

Para que no se arrepientan
las luces tenues encendidas,
escribo cuando nadie sabe;
para continuar de pie, erguida.

Para que no se espanten
el ir y venir del quehacer,
escribo con más ganas de antes;
para vivir un poco más que ayer.

Para que ambas a mí acudan,
las lágrimas y la maravilla,
escribo en fracciones de segundos;
para saberme realmente viva.","So as not to anger the avenue
muses, I write
in my free time;
so to keep myself alive.

So the saltpeter wearing wings
doesn’t fly away drifting,
I write of beautiful delight;
so to keep existing.

So the dim lights don’t
regret turning on at all,
I write when no one knows;
so to keep afoot, standing tall.

So as not to scare off the
come and go of work and play,
I write more earnestly than before;
so to live a bit more than yesterday.

So tears and wonder
both might arrive,
I write in fractions of seconds;
so to know myself truly alive.","<p>i adore formal poetry.</p>
<p>this poem was tough to translate without sacrificing the rhyme — i’m very thankful for my friend Olive’s help here! i like to say that, when translating, <em>something has to go</em>, be it tone, literalness, or rhyme. i think that translation means composing a poem like a native speaker of another language, but if you keep the form, you usually sacrifice literal meaning.</p>
<p>take <em>alas vistiendo</em>: a native speaker might compose that flourish as “dressed in wings,” but then how do we rhyme that with “existing”?
<em>arrepientan</em> doesn’t have an object in the Spanish… <i>what exactly would the dim lights regret?</i></p>
<p><em>de pie, erguida</em> means “on my feet, standing straight,” but that’s so many words and the tone is all formal. the expression is physical, but the poet clearly uses it symbolically as well.</p>
<p>i took advantage of those ambiguous moments and a little enjambment to preserve the rhyme. the rhythm is light in spanish, whereas my translation stretches and crunches back and forth. something had to go, i think.</p>
<p>the repetition of <em>para</em> was another obstacle, since most literally that’s “for” or at least “in order to.” even my choice to go with “so” is more formal than the relatively neutral register <em>para</em>, but it keeps the motif without taking up too much space. i knew i wanted to translate this poem as soon as i read it. the more i sat with this piece, the more it grew on me. hopefully it’s a reminder to keep <em>me</em> writing; i, too, am keeping alive.</p>
<p>but who are these <em>avenue muses</em>?</p>

","<p>Zoraida Armengol is a Miami-Dade County Spanish teacher whose published books include <em>Un cielo para todos</em> and <em>Las alas de un alma</em>. she was born in Havana, Cuba in 1965.
</p>","<p>howdy, i am Pablo (he/him)! i am Spanish and Cuban and Miamian! i do science, translation, and tabletop things. i really enjoy translating poems about striking out on one’s own. an urban fantasy novel — about tropical diaspora best friend assassins, spilling cafecito for the cafecito god, and queer spanglish passenger seat conversations — may or may not be forthcoming.</p>",Spanish,es,/assets/images/images_22/armengol.jpg,none,photo by Stacy Shimanuki,,"<div>

<iframe
  frameborder=""0""
  width=""375""
  height=""65""
  src=""https://drive.google.com/file/d/1TGU58DCeXPxUd9Th7qwYsAqDOS1V0yOa/preview"">
</iframe>
</div>","<div>

<iframe
  frameborder=""0""
  width=""375""
  height=""65""
  src=""https://drive.google.com/file/d/1kxjOJ6Nsb-jvcPovr1zpKK9u9L3QoNKk/preview"">
</iframe>
</div>",2022,submission,
whispered,Tiše,Whispered,František Halas,Kathryn Dettmer,"Kláskem hubeným je tělo tvé
z nějž zrno vypadlo a nevzlící
jak klásek hubený je tělo tvé

Přadenem z hedvábí je tělo tvé
toužením popsané do vrásky poslední
jak přadeno z hedvábí je tělo tvé

Spáleným nebem je tělo tvé
čivavě v tkáni smrtka sní
jak spálené nebe je tělo tvé

Přetiché je tělo tvé
jeho pláč zachvívá mými víčky
jak tiché je tělo tvé

<h1>Jistota</h1>

Vcházím do lásky a oslepen
tápám klopýtaje o tmu minulou
milostí tvojí zasažen

Prohledám náhle a již vím
není mi dáno zůstat v tomto ráji
tolik jsem prahnul a přece sem nepatřím

Míjím ač ničeho se nezříkám
zahleděn v tvé oči vznešené
půl smrt půl stín se vkradu tam

","A thin stalk is your body
from which grain fell without sprouting
how like a thin stalk is your body

A skein of silk is your body
desire written on the tissues’s every last wrinkling
how like a skein of silk is your body

A burning sky is your body
furtively, a banshee with it, in the weaving
how like a burning sky is your body

The quiet is your body
its cry sets my eyelids trembling
how like the quiet is your body

<h1>Certitude</h1>

I enter into love and while blinded
feel my way, stumbling into the dark past
of your stricken mercies

I ransack and, unexpectedly and already, I know
it is not a given for me to stay in this paradise
I have so longed and yet do not belong

I pass though I renounce nothing
while staring into your noble eyes
there, I steal into half death half shadow
","<p>The poems here were chosen from the book <em>Krásné neštěstí</em> (<em>Beautiful Bad Luck</em> – or <em>Unhappiness</em>, depending on how you read it), which was first published in 2006 by one of Halas’s sons, a well-known radio presenter in the Czech Republic. The poems were published for the first time alongside the letters that Halas sent them in, to his wife, between the years 1928 and 1939. None of her correspondence is included in the volume.</p>
<p>I chose both poems because they delighted and challenged me. The first thing I discovered is that making things rhyme in Czech is much easier than in English. I was only able to preserve the rhyme in “Whispered,” but since Halas was often accused of not being poetic enough, I figured he would not mind.</p>

","<p>František Halas was born in Moravia in 1901 (when it was still part of the Austro-Hungarian Empire) and died in 1949. He was an active member of the communist Czech resistance to the Nazis and wrote for the illegal communist newspaper, <em>Rudé Pravo</em>. When he died, he was a celebrated poet, an editor at Orbis Publishing House, and the head of the writers‘ union of the Ministry of Information. His poetry, however, was lyrical in nature, eventually leading to a falling out with the communist regime. He was not dialectic enough for communist tastes. During the Prague Spring of 1968, one of his sons, Ludvig Kundera (father of writer Milan Kundera), and others published a book that revived interest in Halas’s early lyric poetry.</p>
<p>Milan Kundera puts Halas’s poems in the hands of the main character of the novel <em>The Joke</em> (<em>Žert</em>), which is how I was introduced to Halas. The protagonist wallows in the poems because he has been exiled for a bad joke. He uses them to seduce a girl, who is happier to hear them than she is with his physical advances. Halas’s poems are melodramatic and strange — my favorite kind of love poem.</p>","<p>Kathryn A. Dettmer is an adjunct lecturer and instructor of French at the University of Pennsylvania, Drexel University, and Widener University. As a Peace Corps volunteer, she had the luck to learn Czech in a castle located in the spa town of Poděbrady before teaching English in an academic high school in
Valašské Klobouky. She is currently translating a YA novel by Véronique Tadjo from French.</p>",Czech,cs,/assets/images/images_22/halas.jpg,../assets/images/images_22/halas2.JPG,photo by Kathryn Dettmer,photo by Kathryn Dettmer,"<div>

<iframe
  frameborder=""0""
  width=""375""
  height=""65""
  src=""https://drive.google.com/file/d/1P-UYmnjajSduW2mD-opeysxyi_0-KnB8/preview"">
</iframe>
</div>",,2022,submission,
