pid,title,transtitle,author,translator,poem,transpoem,note,abio,tbio,language,lang,image,image2,imagecredit,imagecredit2,origaudio,translaudio,edition,pagetype,wrapformat
alcohols-1909,Alcools: 1909,Alcohols: 1909,Guillaume Apollinaire,Saagar Asnani,"La dame avait une robe
En ottoman violine
Et sa tunique brodée d’or
Était composée de deux panneaux
S’attachant sur l’épaule
 
Les yeux dansants comme des anges
Elle riait elle riait
Elle avait un visage aux couleurs de France
Les yeux bleus les dents blanches et les lèvres très rouges
Elle avait un visage aux couleurs de France
 
Elle était décolletée en rond
Et coiffée à la Récamier
Avec de beaux bras nus
 
N’entendra-t-on jamais sonner minuit
 
La dame en robe d’ottoman violine
Et en tunique brodée d’or
Décolletée en rond
Promenait ses boucles
Son bandeau d’or
Et traînait ses petits souliers à boucles
 
Elle était si belle
Que tu n’aurais pas osé l’aimer
 
J’aimais les femmes atroces dans les quartiers énormes
Où naissaient chaque jour quelques êtres nouveaux
Le fer était leur sang la flamme leur cerveau
 
J’aimais j’aimais le peuple habile des machines
Le luxe et la beauté ne sont que son écume
Cette femme était si belle
Qu’elle me faisait peur","The lady donned a gown
Of violet Turkish silk
And her chemise lined with gold
Was made of two drapes
Fastened at the shoulder
 
Eyes dancing like angels
She laughed she laughed
She had a face colored like France
With her eyes blue teeth white and lips so very red
She had a face colored like France
 
She had a low round neckline
And hair styled into a messy bun
With her beautiful arms bared
 
Will we ever hear the clock strike midnight
 
The lady in the violet Turkish silk gown
And chemise lined with gold
Cut round and low
Flaunted her curls
Her golden tiara
And carried her little buckled slippers
 
She was so beautiful
That you would not have dared to love her
 
I used to love cruel women in outlandish districts
Where every day new beings were being born
Their blood of iron their mind of flame
 
I loved I used to love the people deft with machines
Luxury and beauty are but their scum
This woman was so beautiful
That she made me afraid","<p>Translating <em>1909</em> was an absolute treat; it gave me the opportunity to delve into turn-of-the-century Parisian fashions to determine the most fitting translations for words like <em>robe</em>, <em>ottoman</em>, <em>tunique</em>, and <em>Récamier</em>. While trying to reconstruct in my mind’s eye the beautiful dress described in the poem, I realized that the descriptions fit perfectly onto pictures of styles created by the legendary Parisian designer Paul Poiret. Considered the father of the modern runway, Poiret’s designs were in vogue during the early 1910s, and he was celebrated for his emancipatory styles, trading the corset for the sash. Looking at pictures of Poiret’s styles, I came across a picture of his chemise dress, which was a close match for the long silk gown with a tunic draped at the shoulders mentioned in the poem. For that reason, I chose to translate <em>tunique</em> as “chemise” instead of “tunic,” which seemed too facile a choice. I wanted the translation to most clearly evoke the image that Apollinaire had in mind, so I modernized the vocabulary (“coiffée à la Récamier” as “hair styled into a messy bun” and “ottoman violine” as “violet Turkish silk”) while maintaining the overall image as closely to the original as possible.</p>
<p>While some may choose to anglicize the syntax of the poem in translation, I think that there is a certain beauty of meter and rhythm that is lost in such a practice. For example, the line “Les yeux bleus les dents blanches et les lèvres très rouges” could be translated grammatically into English as: “The blue eyes, the white teeth, and the very red lips.” Although pre-positioning of adjectives is most common in English, post-positioning is also possible without greatly altering the meaning. Furthermore, the grammaticalization of the definite article <em>le</em>/<em>la</em>/<em>les</em> in French as a marker of grammatical gender means that in translation to English (which does not have a grammatical gender), it was unnecessary to maintain the definite article. To better flow from the previous line, I added the words “with” (to justify the link between her face and the French <em>tricolore</em>) and “her” (to emphasize the provenance of these patriotic features). The result: “With her eyes blue teeth white and lips so very red” actually flows much better in between the repeated line “She had a face colored like France.” Another line which gave me particular pause was “J’aimais j’aimais le peuple habile des machines.” In French, the imperfect tense (here <em>j’aimais</em>) is inflected through just one word, whereas in English there are three possibilities, usually requiring auxiliary verbs: “I used to love” or “I was loving” or (in a few special cases) “I loved.” However, given Apollinaire’s repetition of the verb, in an almost breathless, stuttering manner, it seemed too verbose to repeat out the entire verbal phrase “I used to love” twice in the same line. Such a repetition would completely efface the uncertainty of Apollinaire’s original. Therefore, I went with a combination of two different verbal aspects: “I loved” and “I used to love.” The result is a more gradual unfolding of the narrator’s thoughts over time, while still retaining the breathlessness of the original. The lack of punctuation across the whole poem adds a level of autonomy to its words, wherein the words derive meaning from their interrelationships, not from the imposition of grammatical symbols (which might also function as a metaphor for the whole poem: a revitalized post-Industrial Revolution France ready to forge its path without the interference of foreign powers).</p>
<p>On the level of the poetic meaning, Apollinaire certainly drew from some easily recognizable tropes to construct his personification of France. The “little golden slippers” and “clock strik[ing] midnight” are clear references to Cinderella and the ephemerality of the riches adorning France during the Belle Époque. The terrific and otherworldly side of fantasy is conjured through his phrase <em>quartier énormes</em> – “outlandish districts.” In this stanza, one is unable to forget the despondence from which Cinderella arose and the vaunted position which she attained over the course of the story. Nonetheless, in writing this poem, Apollinaire was calling to attention the vanity of his country, its obsession with superficial beauty, and the allure of the riches derived from exploitation of machines and people. The beauty of the moment was captivating, but it was also terrifying. Little did Apollinaire know the extent to which the next few years would see the meltdown of humanity within the world he had come to know and love.</p>
<p>I would also like to thank my friends, Jennifer Ye Ji Cho and Younghoon Jeong, for being excellent extra pairs of eyes to look over my translation and providing honest and critical feedback.</p>

","<p>Guillaume Apollinaire (1880–1918) was a literary figure of huge import to French modernist movements. When discussing the beginnings of the <em>avant-garde</em>, Apollinaire’s legacy looms large; his impact on the bohemian persona is just as significant as his writings. An extremely prolific thinker and writer, Apollinaire published poetry, plays, art critiques, short stories, and novels, influencing a wide variety of modern art movements, most notably André Breton’s Surrealist movement. What is perhaps most surprising about Apollinaire is his outspoken distaste for the music being written by his contemporaries. In his <em>Chroniques d’art</em>, he draws a distinction between “modern and new” music, the former being exemplary while the latter the unfortunate consequence of mindless experimentation. Paradoxically, though he describes <em>musique nouvelle</em> (“new music”) as being “obscure, empty, bereft of life, immobile, and enslaved to aesthetics and beauty,” he (perhaps unwittingly) explores the musical idiom in his own poetry and recitation. The Penn libraries are in possession of an original phonograph recording of Apollinaire reciting one of his most famous poems, <em>Le Pont Mirabeau</em> (<em>Mirabeau Bridge</em>). In it, he follows an almost musical contour to his recitation of the poetry, adding vocal ornamentation to the prosody of the language at the end of each poetic line as he speaks into the recording machine. The poem’s intrinsic rhythm is itself strangely reminiscent of a river’s flow: a relentless move forward through the passage of time, punctuated by waves undulating back and forth. Even if Apollinaire disavowed music’s attachment to the aesthetic, it seems that his own poetry could not escape its pull. Apollinaire published his collected poems, <em>Alcools</em> (<em>Alcohols</em>), in 1913, before the outbreak of World War I and the end of the Belle Époque. In 1909, we see an Apollinaire reminiscing on the past, his current moment of relentless change, and uncertainty for what the future will bring.</p>","<p>Saagar Asnani (C’19) is a PhD student in musicology at the University of California, Berkeley. A medievalist, linguist, and poetry enthusiast, Saagar is fascinated by how music and language overlap, interact, and work together in myriad ways within our world. A scholar of fourteenth century French vocal music, he believes that by studying the soundscapes of the past we can learn more about the structures and dynamics of human communication and perception today. Most recently, he has taken up the study of Catalan and Korean. Although his research on medieval music has immersed him in Latin and Middle French, he relishes the opportunity to work on texts in Modern French when it arises. As a graduating senior at Penn in 2019, he was awarded the Clifton C. Cherpack Prize in French Studies. In his free time, he enjoys playing viola and is an active member of UC Berkeley’s Symphony Orchestra.</p>",French,fr,/assets/images/images_22/armengol.jpg,none,photo by Ryan Hardy,,"<div>
<iframe
  frameborder=""0""
  width=""375""
  height=""65""
  src=""https://drive.google.com/file/d/1bSQcXPggZHg-jAR5vzmMwgaQsyaYBup3/preview"">
</iframe>
</div>","<div>
<iframe
  frameborder=""0""
  width=""375""
  height=""65""
  src=""https://drive.google.com/file/d/17NVzJOMqL12P05Y3k0m_WsHQ4NyIebrr/preview"">
</iframe>
</div>",2022,submission,
mother,Anne,Mother,Sirin Parkan,Emre Azizlerli,"sandıktan yemin çıktı
iğne oyalarının arasında sessizce kırgın
sandıktan sır çıktı
avuca geçmiş tırnak izleri terli titrek
sandıktan güzel çıktı
diri meme, kasık, saç ve koku
sandıktan anne çıktı
kapalı dudakları sabırla gerili
sordu
eski bir gülümseme mi satın almak istediğin
","oath came out of the chest
quietly hurt amongst the needlework
secret came out of the chest
nail marks of a clenched fist, sweating and shaking
prettiness came out of the chest
firm breast, thigh, hair and scent
mother came out of the chest
lips shut tight with patience
she asked,
is it an old smile you’d like to buy?
","<p>Translating a poem from Turkish into English is a hard art, since the source language has wildly different grammar and syntax than the target language, and the poem loses the sounds and the multi-layered associations of its words in the source language. As the translator negotiates between the words, sounds, and pauses of the poem in two distinct languages, however, recreating a text in new clothes, the poem may gain a new force and musicality in its new outfit, in this case, English.</p>
<p>Translating Şirin Parkan’s poetry has been such a journey of mental bargaining for me. Her poetry rests on common Turkish words which she seems to reveal from a personal dictionary, with additional meanings that she herself has cultivated, impregnating them with a unique intensity.</p>
<p>Her style is deliberately fluid, with barely any punctuation. She often serves up pauses by line breaks, as if carrying her inner music and rhythm onto the page. She is breaking the standards and accessibility of everyday language to take us into her personal world as a mother, a daughter, a lover.</p>
<p>During translation, this was one of my major concerns: to transfer the alienness of her Turkish into the English language with the same effect. Hence in the poem titled “Mother,” despite the impulse to put an article in front of “oath,” “secret,” or “prettiness”, the words stand alone at the beginning of the lines – just like in Turkish. It is an intervention in English, from a Turkish source, that opens up the possibilities of language.</p>
<p>Interestingly, in translating the word “chest,” out of which the “oath” and “secret” come, the poem gains new resonance in English. In Turkish, the word signifies a chest of drawers or a box. But in English, the chest is also a body part, covering our hearts. In a highly personal poem about memories of family life and growing up, the word “chest” more than fits in, enriching the Turkish. A translator’s triumph, in fierce negotiation!</p>

","<p>Şirin Parkan, born in 1971, has been writing poetry since her early school years, and she has published four books of poetry over the past ten years. Parkan writes poetry alongside her day job as a medical doctor in Istanbul, Turkey, where she works and teaches at the university. She is also a trained actress and performs with the Studio Actors group led by one of Turkey’s leading figures in theater. Parkan has a twenty-year-old daughter, and she is also mother to a six-year-old cat.</p>
<p>As a poet, she has a dense, brooding style, strong in visual imagery, melody, and rhythm. The visual aspects in her poetry show influences both from painting and theater as colors and a photographic sensibility. Her poetry is rich with unconscious cues that would provide fertile ground for psychoanalytic interpretation.</p>
<p>In addition to her four books, Parkan’s poems have been published in leading literary journals throughout Turkey, along with interviews and reviews.</p>","<p>Emre Azizlerli, originally from Istanbul, has been living and working in the UK as a journalist for more than twenty years. He holds a degree in French literature and likes to translate poetry for his own pleasure.</p>",Turkish,tr,none,none,,,"<div>
  <iframe
    frameborder=""0""
    width=""375""
    height=""65""
    src=""https://drive.google.com/file/d/1d5u0RTGF_rDFrUBxiM4gh_44NCIViAx6/preview"">
  </iframe>
</div>
","<div>
  <iframe
    frameborder=""0""
    width=""375""
    height=""65""
    src=""https://drive.google.com/file/d/1mlPwShxmifJifVB_xtJf_7wJwqbEJ6l2/preview"">
  </iframe>
</div>
",2022,submission,
three-poems,,Three poems,Stella N’Djoku,Julia Pelosi-Thorpe,"Se io e tu 
non fossimo io e tu 
chi saremmo esattamente e cosa 
direbbero di noi le mani, questi 
corpi. Saremmo  
lo stesso incastro? Potremmo, 
io e tu, riconoscerci tra mille, 
sarebbero dello stesso blu il cielo e 
le correnti, 
se io non fossi io e tu non fossi tu? 
Non lo so, ma che ci importa? In 
fondo 
io sono io e tu sei tu.


È per sempre 
l’eterna carezza 
luce, grattacieli 
come spighe di grano.  
Oggi non basta nulla  
le ali le stelle 
l’agosto di fuochi  
magnetici al cielo.


Non ti hanno visto 
che nelle foto a colori 
nelle storie 
che racconti modificate di volta in volta 
per non dimenticare. 
Ma avremmo detto tutto di te 
le stesse linee degli occhi 
la certezza di esistere.","If you and I 
weren’t you and I 
who’d we be exactly and what would
our hands say about us, these 
bodies. Would we be 
the same seam? Could we, 
you and I, recognize ourselves in a thousand, 
would the sky and streams be the  
same blue, 
if I weren’t I and you weren’t you?
I don’t know, and what is it to us? At 
heart 
I’m I and you’re you.


An unending caress
is forever 
light, skyscrapers 
like wheat stalks. 
Today nothing’s enough 
wings, stars,
an August of fires
magnetized skyward.


They haven’t seen you 
except in color photos 
in stories 
that change each time they’re told
so as not to forget. 
But we’d have articulated all of you 
the same lines near the eyes 
the certainty of existing.","<p>The second two of these three poems by Stella N’Djoku can be found in her debut collection <em>Il tempo di una cometa</em> (Edizioni Ensemble, 2019). The first poem forms part of the new book she is assembling.</p>
<p>N’Djoku’s modern elegies traverse cycles of intergenerational grief and rebirth. In these three texts, her poetic speakers question their relationships with other humans as well as with the ever-changing seasons of the natural and animal worlds. Here, flux and stasis, memory and forgetfulness, life and death, entwine.</p>
<p>Caresses can be eternal. Someone only seen in photographs can live on through being articulated. Our organs can be composed of shells and stars.</p>
<p>From my very first encounter with N’Djoku’s verse — in an anthology of poems responding to the pandemic (<em>Dal sottovuoto: poesie assetate d’aria</em>, Samuele Editore, April 2020) — I was enchanted. In interpreting her beautiful, elusive rhythm, I hope to match N’Djoku’s movements as closely as I can while accepting their ultimate untranslatability. It is inspiring to watch my English reach a place of such elegance through correspondence with N’Djoku’s words.</p>
<p>For me, each translation is an approximation, and I carve out many paths initially. I find it so difficult to then choose some above others. This is one of the reasons I engage in retranslations,  revisiting the same poems with different approaches over the years. I hope to retranslate these poems one day too.</p>","<p>Stella N’Djoku is a Swiss poet, journalist, and educator of Italian and Congolese heritage. Her poems are widely published in online literary journals and anthologies. <em>Il tempo di una cometa</em> (Ensemble, 2019) is her debut collection. Currently completing her PhD in philosophy, N’Djoku teaches secondary school students, organizes cultural events, and works with the Italian-language Swiss public broadcasting organization RSI and the Italian WebRadioGiardino. After speaking at the Swiss Literary Festival of Babel, Switzerland in 2021, N’Djoku taught creative writing in the <em>L’altraLingua</em> initiative this February. She is currently at work on her second collection and can be found <a href=""https://stellandjoku.wordpress.com/"">here</a>.</p>","<p>
Julia Pelosi-Thorpe’s translations of Latin, Italian, and Parmesan dialect poetry appear in the <em>Journal of Italian Translation</em>, <em>Asymptote</em>, <em>Modern Poetry in Translation</em>, the <em>Poetry Review</em>, and more. She can be found <a href=""https://jpelosithorpe.com/"">here</a>.
</p>",Italian,it,/assets/images/images_22/n'djoku.jpg,none,photo by Ryan Hardy,,"<div>

<iframe
  frameborder=""0""
  width=""375""
  height=""65""
  src=""https://drive.google.com/file/d/1Qi1pKy_UbfgI7yHcGobHwbHHAgHOZ5dt/preview"">
</iframe>
</div>",,2022,submission,
the-universe-blames-me,تلومني الدنيا,The universe blames me,Nizar Qabbani,Michael Karam,"تلومني الدنيا إذا أحببته
كأنني.. أنا خلقت الحب واخترعته
كأنني أنا على خدود الورد قد رسمته
كأنني أنا التي..
للطير في السماء قد علمته
وفي حقول القمح قد زرعته
وفي مياه البحر قد ذوبته..
كأنني.. أنا التي
كالقمر الجميل في السماء..
قد علقته..
تلومني الدنيا إذا..
سميت من أحب.. أو ذكرته..
كأنني أنا الهوى..
وأمه.. وأخته..
هذا الهوى الذي أتى..
من حيث ما انتظرته
مختلفٌ عن كل ما عرفته
مختلفٌ عن كل ما قرأته
وكل ما سمعته
لو كنت أدري أنه..
نوعٌ من الإدمان.. ما أدمنته
لو كنت أدري أنه..
بابٌ كثير الريح.. ما فتحته
لو كنت أدري أنه..
عودٌ من الكبريت.. ما أشعلته
هذا الهوى.. أعنف حبٍ عشته
فليتني حين أتاني فاتحاً
يديه لي.. رددته
وليتني من قبل أن يقتلني.. قتلته..
هذا الهوى الذي أراه في الليل..
على ستائري..
أراه.. في ثوبي..
وفي عطري.. وفي أساوري
أراه.. مرسوماً على وجه يدي..
أراه منقوشاً على مشاعري
لو أخبروني أنه
طفلٌ كثير اللهو والضوضاء ما أدخلته
وأنه سيكسر الزجاج في قلبي لما تركته
لو أخبروني أنه..
سيضرم النيران في دقائقٍ
ويقلب الأشياء في دقائقٍ
ويصبغ الجدران بالأحمر والأزرق في دقائقٍ
لكنت قد طردته..
يا أيها الغالي الذي..
أرضيت عني الله.. إذ أحببته
هذا الهوى أجمل حبٍ عشته
أروع حبٍ عشته
فليتني حين أتاني زائراً
بالورد قد طوقته..
وليتني حين أتاني باكياً
فتحت أبوابي له.. وبسته","the universe blames me if I love him 
as if I created love and invented it 
as if I had drawn it on the cheeks of roses 
as if I were the one who 
had taught it to the birds in the sky 
and planted it in wheat fields 
and stirred it in seawater 
as if I am the one who
had hung it 
like the moon in the sky 
the universe blames me if 
I name who I love or mention him 
as if I were passion 
and its mother and its sister 
this passion that arrived 
from where I hadn’t been expecting 
different than all I had known 
different than all I had read 
and all I had heard 
had I known that it was a 
type of addiction I wouldn’t have taken it 
had I known that it was 
a windy door I wouldn’t have opened it 
had I known that it was 
a matchstick I wouldn’t have lit it 
this passion is the most violent love I’ve lived 
I wish when he came to me
arms wide open I had turned him away 
I wish that before he killed me I had killed him 
this passion I see in the dark 
on my curtains
I see it in my dress 
and in my perfume and in my bracelets 
I see it drawn on the faces of my palms
I see it carved on my feelings 
had they told me that he was
a loud and playful child I wouldn’t have let him in 
had they told me he would break my glass heart I wouldn’t have let him 
had they told me 
he’d set a fire in minutes 
and he’d make a mess in minutes 
and he’d dye the walls red and blue in minutes
I would have expelled him 
dearest precious who 
got god to pardon me if I loved him 
this passion is the most beautiful love I’ve lived
the greatest love I’ve lived 
I wish when he came to me visiting
I had surrounded him with roses 
And I wish when he came to me crying
I had opened my doors and kissed him ","<p>I chose to translate a Qabbani poem because of how much his name and works remind me of my early schooling in Lebanon. While he is not as famous in America, I hope this is a step toward a growing fascinated audience. Because Arabic is a gendered language, it is clear that the speaker is a woman, a fact which gets lost in English. Because the word “passion” (<span lang=""ar"">الهوى</span>) and the speaker’s lover both use the same set of masculine pronouns, a reader of the original cannot properly identify to whom or to what the speaker is referring. In English, these two nouns use different pronouns (“it” and “he,” respectively), requiring the translator to decide when “passion” was the antecedent and when it was the lover. The original, like most modern poems in Arabic, uses ellipses heavily, which I don’t enjoy as much in an English poem; I opted for longer spaces instead.
</p>","<p>Nizar Qabbani (1923–1998) is a timeless Arab poet known for his sensual and romantic verse. A lawyer by training, he spent more than twenty years working as a diplomat. In addition to his two dozen volumes of poetry and his contributions to the Lebanese newspaper <em>Al Hayat</em>, his poetry has been sung in lyrics by Lebanese and Syrian vocalists, popularizing his work. People, young and old, in Lebanon — he lived in Beirut for a while — and Syria, his home country, sing along to these familiar tunes. Qabbani writes of romantic and political despair and advocates for Arab nationalism and social freedoms for women.
</p>","<p>Michael Karam (Penn C’17) is a translator, writer, and poet living and working in Brooklyn, New York. Michael grew up in Lebanon, between a small apple-growing village and a Beirut suburb. He is fluent in Arabic and French, knows some Spanish, and has recently taken up knitting. He currently works in marketing and fundraising for a non-profit news organization, The GroundTruth Project, which supports emerging journalists reporting on under-covered stories around the world.</p>",Arabic,ar,/assets/images/images_22/qabbani.jpg,none,photo by Michael Karam,,"<div>

<iframe
  frameborder=""0""
  width=""375""
  height=""65""
  src=""https://drive.google.com/file/d/1E7LLnQLe_X_tMggIOlQvEKP5ZBSFBysE/preview"">
</iframe>
</div>","<div>

<iframe
  frameborder=""0""
  width=""375""
  height=""65""
  src=""https://drive.google.com/file/d/1Qi1pKy_UbfgI7yHcGobHwbHHAgHOZ5dt/preview"">
</iframe>
</div>",2022,submission,
